reviewId,userName,userImage,content,score,thumbsUpCount,reviewCreatedVersion,at,replyContent,repliedAt,appVersion
7b7b740a-3f99-4645-9364-8b00be956a64,CueSta Beatz,https://play-lh.googleusercontent.com/a-/ALV-UjVKJJknoJfDfDgF4petFirCJTBJ1J6lBqsDOpe31ZByBlmx8RAz,"kept working normally till got error message validatepassword ( using family view, accept pin even right one )",3,0,,2023-08-24 10:11:21,,,
6d55727f-8a5d-4df6-87f5-c2fc340e7742,Hubble Ohfour,https://play-lh.googleusercontent.com/a-/ALV-UjUlVK7BoYpIr0oyjLnW1-RkKnF3Hp76kxwTp7LY2d5OBg-j6Ad8,"mobile app job mostly, navigation plain painful. easier shut app start again.",3,0,3.9.2,2024-10-29 01:33:26,,,3.9.2
e8b8a520-0dc5-4ffe-a034-5d36388fc1e8,A Google user,https://play-lh.googleusercontent.com/EGemoI2NTXmTsBVtJqk8jxF9rh8ApRWfsIMQSt2uE4OcpQqbFu7f7NbTK05lx80nuSijCz7sc3a277R67g,"ok. clearly wasnt modified phones, difficult read text sometimes. everything else fine tho",3,0,,2019-10-12 07:07:29,,,
3c6e13ab-80c6-4c20-a525-b336903a5c55,Tema5002,https://play-lh.googleusercontent.com/a-/ALV-UjU5C3Q_kc9RTvUfsdwnBUsfjjw2KaA5H3si5yzA3_a0hWur4YpN,works mostly fine exactly fine family view works like absolute dogwater especially poor internet might need enter 4 digit code times actually works please improve,3,0,3.10.5,2025-11-25 13:07:44,,,3.10.5
59369cd2-c176-43ee-9f1c-0382363d897b,Kadin Kimler,https://play-lh.googleusercontent.com/a-/ALV-UjXbsNJAc_nTOPBaxuwm35i0JO2LfV2ctZNN4bUQmhnZNTidAsdP,fun use since logged new account library keeps errors loading pls fix bug,3,0,3.10.5,2025-10-20 05:18:48,,,3.10.5
41b86817-8598-4d58-80ab-c9516d07990c,Steven Jimenez,https://play-lh.googleusercontent.com/a-/ALV-UjWrfxhyoqJc6qb9D5Obn8YUO4W4gqokk76wxZlHvryxX-cE2v2m,little buggy glitchy hate sign wish another way sign steam,3,0,3.10.3,2025-10-10 13:32:49,,,3.10.3
768187c2-e963-4a7c-b854-284dae9fca8d,A Google user,https://play-lh.googleusercontent.com/EGemoI2NTXmTsBVtJqk8jxF9rh8ApRWfsIMQSt2uE4OcpQqbFu7f7NbTK05lx80nuSijCz7sc3a277R67g,love app notifications stopped working. makes hard know someone messages me.,3,0,2.3.9,2019-03-14 17:27:33,,,2.3.9
ce1d6b94-aeab-4cb6-9e28-c4751b0237b8,A Google user,https://play-lh.googleusercontent.com/EGemoI2NTXmTsBVtJqk8jxF9rh8ApRWfsIMQSt2uE4OcpQqbFu7f7NbTK05lx80nuSijCz7sc3a277R67g,works nice issues like app locking 2 days changed password. give stars fix,3,0,2.3.1,2018-10-28 23:11:18,,,2.3.1
6eb863f9-cfd2-4cf1-9db5-2de3306eabf5,Tome Toms,https://play-lh.googleusercontent.com/a-/ALV-UjW1jZYWQTKVvHxNfypeJfdg8Dw-2okMsBkJrUVi9Nl2wya8wuM,fine till whenever try confirm selected items says confirmation error sell item.,3,1,2.3.13,2022-07-13 15:17:31,,,2.3.13
592538cf-f624-4cf6-b9fc-58f678e0c8d4,Pineapples On Pizza,https://play-lh.googleusercontent.com/a-/ALV-UjVTisp433drF0VxhFaGtmldUlX8F7TmMxZ81kjfBf3gRKD4i-dn,"dislike fact authenticator code widgets minimum size increased axis despite needing much space, alright otherwise",3,0,2.3.12,2020-06-23 17:34:48,,,2.3.12
856d3f6b-87ed-4755-8c91-e6f2f7570391,CheeseMan,https://play-lh.googleusercontent.com/a-/ALV-UjWnnkGcWwDLDgiKagbMIorQVp55OT4DRCPLfyyjIYQTgCra2xZe,really underwhelming app use go chat features far behind be.,3,0,2.3.12,2021-02-21 05:45:46,,,2.3.12
bd64d1c3-a61c-43aa-a84d-c57ee46d7eae,Haziq Zikri,https://play-lh.googleusercontent.com/a-/ALV-UjU1p7meyFhL2ABMx_bwfOEIekch3Ft2CdhvyouwEyiiK3LC80llTg,installed wanted account secure authenticator. shocked design layout low quality think steam must improve apps design like version apps android kit kat android old version.,3,0,2.3.12,2020-10-11 16:33:23,,,2.3.12
51f32074-380c-45d8-be4e-6d7e0e22f18c,A Google user,https://play-lh.googleusercontent.com/EGemoI2NTXmTsBVtJqk8jxF9rh8ApRWfsIMQSt2uE4OcpQqbFu7f7NbTK05lx80nuSijCz7sc3a277R67g,gets job done. ui dated poor. looks like something gingerbread era. please update ui.,3,18,2.3.8,2019-01-21 13:27:33,,,2.3.8
eddacc74-ebae-4372-b823-7da211e1be65,Gary,https://play-lh.googleusercontent.com/a/ACg8ocJ3P7nHXXWzFj4yidYy84WdoexAsEA0-w9D2BJryAuO_zcFgQ=mo,use app much. little less steam dashboard pc. say see advantage use steam.,3,0,2.3.13,2022-07-24 06:15:33,,,2.3.13
070731fa-70bd-483b-9beb-f66c9c168501,A Google user,https://play-lh.googleusercontent.com/EGemoI2NTXmTsBVtJqk8jxF9rh8ApRWfsIMQSt2uE4OcpQqbFu7f7NbTK05lx80nuSijCz7sc3a277R67g,"love steam. take wrong way. computer worked fine. however, mobile different. let play games already downloaded it. please fix rate 5 stars.",3,1,2.3.8,2019-02-06 09:02:56,,,2.3.8
1aca14aa-72dc-4cd7-be60-2f6d1508956b,A Google user,https://play-lh.googleusercontent.com/EGemoI2NTXmTsBVtJqk8jxF9rh8ApRWfsIMQSt2uE4OcpQqbFu7f7NbTK05lx80nuSijCz7sc3a277R67g,tried use app get logged time keeps restarting. makes difficult manage account using it. android s8 phone,3,1,2.3.8,2019-02-03 07:02:19,,,2.3.8
25dd1750-f636-4c03-b69d-4b117cfa3354,Pi gtag,https://play-lh.googleusercontent.com/a-/ALV-UjVIqkik4pd1hUFpfoqQ4AvSej9hCTgx4vzhSOmD5UuNckkp0UW-,"one worst apps ever download anything , installed kept telling install it. another reason spent money credit card, launch, waste money",3,0,,2023-04-30 21:10:44,,,
15af9835-e23c-461a-99c9-50a89dcc5870,A Google user,https://play-lh.googleusercontent.com/EGemoI2NTXmTsBVtJqk8jxF9rh8ApRWfsIMQSt2uE4OcpQqbFu7f7NbTK05lx80nuSijCz7sc3a277R67g,"needs nothing more. guess that's good bad, wish emulated pc experience bit more.",3,0,2.3.11,2020-01-22 02:53:13,,,2.3.11
b9d890a2-371e-48da-9ae5-81d203f59f33,Adam Bowie,https://play-lh.googleusercontent.com/a-/ALV-UjUxaLiyLOY6UVOi_pQJLoXeQWyGbL8icuzCShiQ0Zpn683hTCQ,"usable sure amazing. truthfully probably better using steam website browser, excluding needing steam guard",3,0,2.3.13,2022-02-07 04:07:06,,,2.3.13
c1802ab0-5bf4-47ec-8513-e4bee7e24757,RealSeraphimZero,https://play-lh.googleusercontent.com/a/ACg8ocIRVvGdITYi0NE2afL90MbwfeH4O8NAq1ciUIbxjdSRWTGQMg=mo,"manly used old app steam guard chat. removed chat, add (for me) useless functions need 2nd app chat again...",3,0,3.0,2022-10-15 06:33:04,,,3.0
9f64074e-eb5b-4467-8411-31b844f27137,Everice,https://play-lh.googleusercontent.com/a-/ALV-UjW2w7svKOatFktq87Pa-f47vSX0UF0xBw4i_oc794irHpVir9yY,"fix oversized ui. app still good discussion, store etc.. ui boxes large. mean ui ok boxes larger size",3,0,3.7.3,2024-01-04 20:05:32,,,3.7.3
ae1f2dc4-336d-4319-88a7-d0bf1821da44,A Google user,https://play-lh.googleusercontent.com/EGemoI2NTXmTsBVtJqk8jxF9rh8ApRWfsIMQSt2uE4OcpQqbFu7f7NbTK05lx80nuSijCz7sc3a277R67g,"slow, takes lot power bad ui. sad since app lot potential. mobile eh",3,0,2.3.10,2019-06-29 17:43:57,,,2.3.10
37f634b3-6733-4809-a9c4-5103c6b43be8,Alen Kralj,https://play-lh.googleusercontent.com/a-/ALV-UjVePGjF5-0CuEuihoxQKSMm3MF9gS46YaEVuLfnSMUConYmMu8XdA,"send trade offers. says ""there problem performing action. please try request later.""",3,1,3.0,2022-10-16 17:12:29,,,3.0
e7b322ee-38d2-4200-903b-6d343e93ac81,A Google user,https://play-lh.googleusercontent.com/EGemoI2NTXmTsBVtJqk8jxF9rh8ApRWfsIMQSt2uE4OcpQqbFu7f7NbTK05lx80nuSijCz7sc3a277R67g,"app really cool all, everytime switch app logging makes restart again.it's really annoying me.",3,0,2.3.8,2019-02-21 19:59:35,,,2.3.8
7818eb44-8da1-4ee5-bc77-4423e54c4586,A Google user,https://play-lh.googleusercontent.com/EGemoI2NTXmTsBVtJqk8jxF9rh8ApRWfsIMQSt2uE4OcpQqbFu7f7NbTK05lx80nuSijCz7sc3a277R67g,works old unpolished. fun stuff. cool stuff. use authenticator. everything else app meh :(,3,1,2.3.11,2019-12-04 08:36:46,,,2.3.11
f1dceefb-c3cf-4c96-9069-ac6036eb92fc,tyler,https://play-lh.googleusercontent.com/a/ACg8ocLejwajQzcZv7aFzfUFkQNxI3B1TjmP7Jas-0DGB5ptkS_ypg=mo,"use store time. however, forums broken unable read titles discussion. seems like obvious fix...",3,2,2.3.13,2021-11-22 01:52:39,,,2.3.13
ecb5daf3-9965-44c7-81b7-de089aa74425,ivan rumbuhang rai,https://play-lh.googleusercontent.com/a-/ALV-UjVDqkotQJXSR_hQlW2c3G5_fkc0EklDWOdeGjn_dC_GNnVy4VY,steam app open. flickers goes back home page. trying reinstall again. hope works,3,0,3.6.8,2024-03-31 22:58:04,,,3.6.8
f71c3ded-9e27-4126-86e2-f6ab18791191,Joshua,https://play-lh.googleusercontent.com/a/ACg8ocI94GUDv1KZQcbnOJYro_sRHwpXwS0JW6DS84d3k-ZyjMFDiPs=mo,hard long reset ur password forget verification sometimes tells invalid,3,0,3.6.3,2023-07-17 14:42:09,,,3.6.3
6475b5d6-1693-45ae-b7d6-cecebfabb9d8,A Google user,https://play-lh.googleusercontent.com/EGemoI2NTXmTsBVtJqk8jxF9rh8ApRWfsIMQSt2uE4OcpQqbFu7f7NbTK05lx80nuSijCz7sc3a277R67g,"nice app all, consuming data like crazy! even youtube takes much data app!",3,0,2.3.1,2018-09-27 05:35:19,,,2.3.1
ccccf510-fe2f-4e1e-bd80-0bde5552a825,Josiah Kangas,https://play-lh.googleusercontent.com/a-/ALV-UjVRmJ8N4V1J8CgccoxsS2naETlc46USeLt_bZo8A4WuQgHmD4Q7Gw,"mean... works. interface looks like something see phone 10 years ago. is, terrible, great.",3,3,2.3.13,2021-09-13 23:03:54,,,2.3.13
902d4f5a-9577-4ee8-8c93-406ef3097417,A Google user,https://play-lh.googleusercontent.com/EGemoI2NTXmTsBVtJqk8jxF9rh8ApRWfsIMQSt2uE4OcpQqbFu7f7NbTK05lx80nuSijCz7sc3a277R67g,"working fine past 2 years, started crashing unexpectedly year. idea why. fix?",3,3,2.3.8,2019-01-25 13:44:58,,,2.3.8
d8dbafde-f457-4d9d-beb3-ba8f2c021c93,Namdoog Luas (FlammableGas),https://play-lh.googleusercontent.com/a-/ALV-UjUnUv2HM3CySjn3bpROKG7rv5jqvsbbWypvNRChRKwpL3oAl8a9,"qr code sign-in thing nice fan ui redesign, gets real confusing used last version app",3,0,3.0,2022-10-17 02:09:31,,,3.0
2531c17f-2cd1-4f1b-ba7a-a94206c4ec4e,A Google user,https://play-lh.googleusercontent.com/EGemoI2NTXmTsBVtJqk8jxF9rh8ApRWfsIMQSt2uE4OcpQqbFu7f7NbTK05lx80nuSijCz7sc3a277R67g,resetting password swapping apps collect email reset code app returns username password screen making code useless. poor stream,3,0,2.3.1,2018-11-28 18:34:56,,,2.3.1
dc5b9be4-fce5-4c39-b5d4-44325f367139,Reinalyn Herrera,https://play-lh.googleusercontent.com/a-/ALV-UjUq4HNpHXw2MkEJxuT8pTD730DjjhBx5-WUC0h2qE793jhU3QRT,"app working, says ""too many login failures, please try later"", started using it.",3,0,2.3.12,2020-10-12 22:43:43,,,2.3.12
268e2db9-a619-44a1-b7d3-bdb6906ead12,Kaleb Croxall,https://play-lh.googleusercontent.com/a-/ALV-UjV_KNgYyd4Qz_EAm02r3nrTgMSSJbn5oXd_FGoT6ag2bchK3QXqnw,"customer support downright awful. app good enough though. lets text friends, know; gets job done.",3,0,,2021-09-15 20:14:48,,,
dfe3e41e-8b1d-4b6e-8ee9-7a979fc2aafe,A Google user,https://play-lh.googleusercontent.com/EGemoI2NTXmTsBVtJqk8jxF9rh8ApRWfsIMQSt2uE4OcpQqbFu7f7NbTK05lx80nuSijCz7sc3a277R67g,works functional really use ui upgrade. however apps really needs data saving option load lower quality images bit data intensive,3,0,2.3.1,2019-08-14 04:57:09,,,2.3.1
a51a78e5-5ad7-4baa-a4fa-ecf5780d50b3,johana castillo,https://play-lh.googleusercontent.com/a-/ALV-UjXJwb1iVT1UGPg9GZn98uAm56wSGveO1c6Vpolv4kgDI_wNclw,please ad make account button never made downloaded steam still says please sign annoying join please that?,3,0,3.0,2022-11-13 07:40:03,,,3.0
241ca99d-0701-49ea-8df5-b0185fc11d4e,A Google user,https://play-lh.googleusercontent.com/EGemoI2NTXmTsBVtJqk8jxF9rh8ApRWfsIMQSt2uE4OcpQqbFu7f7NbTK05lx80nuSijCz7sc3a277R67g,"well made, need something talk friends away pc, it'll job, although sure plenty better",3,0,2.3.1,2018-10-13 12:27:39,,,2.3.1
b297b9fc-43b9-4f9d-960c-eb089a2a76eb,ivana ivanovska,https://play-lh.googleusercontent.com/a-/ALV-UjWnVoPH6pfU8BK859xjgGjWAvKXWS1ZcXsO9490kBVfOvg2SDk,"enter family share pin every click make? anoying, please fix that. someone enter pin, dont see reason enter again.",3,1,3.5,2023-03-02 12:52:49,,,3.5
99bc9d17-93e7-4f7f-bb8a-bde72424c252,Alex Schendel,https://play-lh.googleusercontent.com/a-/ALV-UjVj-1_IIM4gpUtqcslRCUjnXDtQmuXvmak5P5KfNC5l7ABKAgx1cg,"overall, like new update lot. lot responsive intuitive. however, really dislike much different functions getting segmented... need three+ apps access core features steam mobile??? roll back one app please.",3,1,3.0,2022-10-14 04:19:12,,,3.0
0a99482b-7270-4ed0-9cb9-2b7336ebe939,Chris,https://play-lh.googleusercontent.com/a/ACg8ocI78PuBVziXwblYB-rC6upr7ueCWS9ELEFdrY83Yee79UPM=mo,really like ability view friends online games playing.,3,0,3.10.5,2025-09-16 22:33:46,,,3.10.5
1843fdd4-26da-4f75-ac0e-c45422ced72b,Visciralis,https://play-lh.googleusercontent.com/a-/ALV-UjXhkQPGKe6XDHSjWeupPIqwL5SiMfv2C8fPLeaPqlRsj7haW5Ie,"app looks much better, app tends crash whenever 2 gifs screen, making points store almost unusable",3,0,,2022-10-18 14:26:28,,,
6568934a-1753-405f-b3e1-3a6f748cb96d,Barry Lopes,https://play-lh.googleusercontent.com/a-/ALV-UjXJAs7mvqcUBRYZq89QFVLXuJQ_AnLY6PNaF3GVYGpBd4I5Ivtr,"good app, issue's syncing game libraries (wishlist, cart, etc) otherwise really good use",3,2,2.3.13,2021-09-14 16:19:49,,,2.3.13
b90206f6-26fd-40ae-bd1f-c944edf34c31,Ximina Cortes,https://play-lh.googleusercontent.com/a/ACg8ocKH-7gDgydl58VYvgGvhH1fh1xxnx7YerGcTW4Gotayq0QVSw=mo,"rated 3 star ive dealing ""the account name password entered incorrect."" 1 week even putted right password username",3,0,2.3.13,2021-09-12 03:08:24,,,2.3.13
ba6da1e9-5f44-4be9-9740-48c40d5cdfae,Alexander Babintsev,https://play-lh.googleusercontent.com/a-/ALV-UjVH5JhSoYBSLlaXmo7-m6Oo1aqsnDf8JHmz36m6xj1Xk4wu-K62lQ,"say app much value, like browse games also notifications value. please add indicator whenever game compatible steamdeck.",3,0,3.6.5,2023-08-05 16:37:22,,,3.6.5
8386ada4-bdb4-42ad-a57e-d1e4cf082ded,A Google user,https://play-lh.googleusercontent.com/EGemoI2NTXmTsBVtJqk8jxF9rh8ApRWfsIMQSt2uE4OcpQqbFu7f7NbTK05lx80nuSijCz7sc3a277R67g,"everytime try setup authenticator, tells error accessing steam servers. valve, please fix problem.",3,0,2.3.1,2018-12-09 21:08:43,,,2.3.1
b14dd6c1-80f8-4722-84ee-f07e9539b759,Connor Mitchell,https://play-lh.googleusercontent.com/a-/ALV-UjXIkAnPDJwsS4RzGhNudvebXZPyNSYVinvGwSx18Iw9N-Xz57Qm,even functional. used buying steam games checking messages edit: giving 3 stars used 2fa useful.,3,0,3.3,2023-01-03 20:07:22,,,3.3
6ace6cbb-179e-4dda-be6d-443a5e59d5cb,Sreeraj P,https://play-lh.googleusercontent.com/a-/ALV-UjXJpsdm5i77Gnps5w4NqeP9BIeVopu3oqCEHVgXcSU0-e76hkSv,unable purchase stuffs app! apart fine..also group chat available one!,3,0,2.3.11,2020-06-06 20:49:01,,,2.3.11
42e3a640-40f3-4e5b-a903-7a0bcac600b2,Talon Smith,https://play-lh.googleusercontent.com/a-/ALV-UjVJbqyshaXeEPm_oCo2iEmfJkxifnPu0wPTJlA7BO1KJ-OGWDM,"please help make account matter email, nothing wrong deletes info. know fix this.",3,0,2.3.13,2023-12-04 03:59:11,,,2.3.13
29f23529-fab0-41c4-bf2b-b3d1fc6bdaa3,Souvik Paul,https://play-lh.googleusercontent.com/a-/ALV-UjX7GMDXEOTrJ629cyA0HyNIFfBpCIj7sU7tZLn9rJkb-ZfC0sUX,extremely good app think team add notification option easily get one messaged us please add notification option,3,0,2.3.12,2020-11-19 15:09:48,,,2.3.12
ed31766b-b710-4ad8-9ef9-774a3d1cbc2c,Nadja Jovanovic,https://play-lh.googleusercontent.com/a-/ALV-UjXPt6FYVCkHu7qOwIElvoqlLh88WfOfHF1ZTl4KX7C_OhX4KeU,"help, computer tried sign in, kept repeating 'are robot' not, point unsure something wrong computer/network pure torture 😭",3,0,3.7.0,2023-10-28 03:09:56,,,3.7.0
4d35503a-3c2b-49f3-9949-632ae16200a5,Donnie Ruble,https://play-lh.googleusercontent.com/a-/ALV-UjU9I8KMkJ3aAG9zYSZ4dIaHPCukJCj3NriFgVsjTTGDFM0I7GU_,"honest, installed software tattletail, let create account. enter gmail, verify gmail, go back app. go sign in, let sign in. anyone know use existing account name password, (what have), way sign know 13 small brain process it? anyone advice, please let know.",3,2,2.3.13,2022-01-20 11:36:27,,,2.3.13
cdb572d6-850b-4cf0-a844-89b9faf46d44,A Google user,https://play-lh.googleusercontent.com/EGemoI2NTXmTsBVtJqk8jxF9rh8ApRWfsIMQSt2uE4OcpQqbFu7f7NbTK05lx80nuSijCz7sc3a277R67g,"inventory black time, waited 10min... still black... please something this. that, app describes. ×tested huawei p20 lite",3,0,2.3.1,2018-11-13 20:05:56,,,2.3.1
f774e9f6-d9de-47b5-93a6-e24f202761ed,Winter Deniega,https://play-lh.googleusercontent.com/a-/ALV-UjVrKPVTiOAFS1iRdK0OETnMWQHLs0JFwxIf8dpoYjRZ4QjT2S6Q,probably introduce feature able download soundtrack media directly mobile ease use,3,0,3.7.3,2024-03-18 20:27:39,,,3.7.3
97bc0068-69c2-48c4-9b76-069c9dc958ba,Garrett Szilard,https://play-lh.googleusercontent.com/a-/ALV-UjWTrVHmcQpDNKmcEdu7YeXq90p28wL7TgnuF2yRNanHmKKp2Zfd,protective. makes sense stay forced signed phone. decided uninstall want running draining battery.,3,0,3.5,2023-04-04 23:53:55,,,3.5
034981a4-dd4d-4e29-9a0d-bab16e5c39be,Tristin Sterling,https://play-lh.googleusercontent.com/a-/ALV-UjXosCYDutoVYCLP4KfJLIddBqpYkIriXSvuX6quOQM0Y2sCRPRv,removed chat feature moved unnecessarily seperate app. much less fun use.,3,0,3.0,2022-10-13 09:05:15,,,3.0
4fd1c17e-3345-424f-ba4c-f388d88f9fd5,A Google user,https://play-lh.googleusercontent.com/EGemoI2NTXmTsBVtJqk8jxF9rh8ApRWfsIMQSt2uE4OcpQqbFu7f7NbTK05lx80nuSijCz7sc3a277R67g,payment window novaplay open order browser. otherwise everything good.,3,0,2.3.1,2019-01-01 14:35:05,,,2.3.1
9cf90d55-d5fc-470d-922a-775f0a9343fe,Valeriy Zlatov,https://play-lh.googleusercontent.com/a-/ALV-UjXvcPjhF2CexiRlE7IKtKnb1HCm8Dmk5l7MtHIcyvh6exiuGK_0Dw,"design outdated, buttons work half time, guess least thankful steam app, unlike gog egs",3,0,3.6.3,2023-07-04 08:24:55,,,3.6.3
6c77362f-948f-4e09-8249-3539efe2d3eb,Miss Na Kita,https://play-lh.googleusercontent.com/a-/ALV-UjWH8xhOcN6XiQN8cQPgAbXMVpL7I8L8mwWHRU8pKlWRqIHHAr3Y,well often log's log back says password incorrect even checked twice pls fix log back,3,0,2.3.13,2021-12-14 13:30:27,,,2.3.13
ffe5d31b-8c0f-406b-a962-1282c610832d,Wayne Scannell,https://play-lh.googleusercontent.com/a-/ALV-UjXO-y10LjlqotfwfIAYEOBWpVPbVAZjZQrmHH-_oQI9l44R9zqp,good app u play games u brought steam it. even ones require lot graphics.,3,0,,2020-12-22 19:50:18,,,
4fa85807-aa3f-4f35-9fb2-3ecafbb954db,AQUIB AHMED,https://play-lh.googleusercontent.com/a-/ALV-UjVx74bJ5DCMsvhjwkEeTQv937msiCt3wuHcseP8YsaHd6ZD4aQu,god sake add select button something confirmation window. time consuming manually select thing.,3,0,2.3.11,2022-10-30 09:31:38,,,2.3.11
448d6653-64bf-42b2-84f1-da13d9a591f1,Rosco Fairley,https://play-lh.googleusercontent.com/a/ACg8ocKbxkm6M4M72Sct2o4sB5gwDitFwFa__xwvoYW2natQMkaoh0I=mo,overall app working pull games store show collection. needs fixed!!!,3,0,2.3.12,2020-12-26 02:42:23,,,2.3.12
a246351e-73d5-40c8-8526-9dfdec690175,Lee Birdsall,https://play-lh.googleusercontent.com/a/ACg8ocKcF7A_APXXLZsdTSMfLAatJt3ryNMP473oNHOelu-_qtvxQg=mo,ok go full screen watching someone's broadcast. clicking thing nothing.,3,1,2.3.13,2022-02-22 09:47:36,,,2.3.13
8c83c02e-e78b-459c-9aaf-cf6028c5ac81,Lara Kelly,https://play-lh.googleusercontent.com/a-/ALV-UjXhyuM2ZY09lIRR-9Zu2B6e3e7MdxYNGTlQ61oOHxmWV2eQI64b,"tried app still didnt get play games new chromebook....i wish someone, namely developers, work that.",3,0,,2022-02-07 02:55:37,,,
4a9afa62-abb9-4266-9128-067930cee0bc,Aswin v s,https://play-lh.googleusercontent.com/a-/ALV-UjVy3FFgz8iwtpwv3nwWLB7xD5-XAzRrkbGD-DHW6t06Rb301Xt5,loading issue. gets fixed updating. really annoying considering fact constant updates,3,0,3.7.7,2024-05-03 00:09:12,,,3.7.7
808727b2-40c4-40c4-a614-43c54142e66e,Sema San,https://play-lh.googleusercontent.com/a-/ALV-UjUByXnYoJ-_Bt7vqGRspu0E2ntsIvOn9qo5Jnhkv11OYAI74jab,"steam phone. sometimes making transactions work, doesn't, need wifi.",3,0,2.3.12,2020-09-18 23:24:33,,,2.3.12
71d85948-27aa-4e20-aee7-6e96cbbf210d,Spencesky,https://play-lh.googleusercontent.com/a/ACg8ocL1yx7ruqIvuondI-1SJwiUN4nIo9BMnf_ARSyFw6l-LqjxWg=mo,"terrible trying access account already have, authenticator work flagged account taking half hour change password make know user",3,11,3.9.6,2025-01-19 19:43:15,,,3.9.6
ac33d35a-b245-4863-9d8f-73eb9c094a67,A Google user,https://play-lh.googleusercontent.com/EGemoI2NTXmTsBVtJqk8jxF9rh8ApRWfsIMQSt2uE4OcpQqbFu7f7NbTK05lx80nuSijCz7sc3a277R67g,already read... notification keep going show out... computer steam received message phone long time ago still cant receive !,3,0,2.3.1,2018-11-07 23:45:03,,,2.3.1
5e04c238-34de-4252-a101-ea9eaba85cf0,Moon Light,https://play-lh.googleusercontent.com/a-/ALV-UjXOPcKx3VsybNsoerVIDZ-2_YU5yVX6lFYQEEWV_RWi-lzW3kE,find inability view screenshots (that posted) steam mobile quite frustrating.,3,2,2.3.13,2021-11-09 09:14:23,,,2.3.13
7a78526c-6dd0-4137-8157-b42e4a39efae,Jericho Wolf,https://play-lh.googleusercontent.com/a-/ALV-UjXmh0Va6vnrdWtduxFkolT5iafaPxdL4NBAoZI8-a3VsTYjNYw,hate logs dont remember password.,3,0,3.10.7,2026-02-06 13:23:40,,,3.10.7
059ed344-ffa6-4984-b0ae-bc0b2937f0d2,Nathanael Sintong,https://play-lh.googleusercontent.com/a-/ALV-UjUltbUzmOI9NDZzbv2u25uwPTizhwCa0rrPqH3sVl0u9RTW6heA,latest update makes app look better easier navigate also makes slower whole lot buggier. volvo pls fix 🙏🙏🙏,3,1,3.0,2022-10-31 12:21:52,,,3.0
540498b0-9492-4402-9e77-32c602a56cb5,Morgan,https://play-lh.googleusercontent.com/a-/ALV-UjXuu4J_B15B2hSG4lUrTKA-D9tZ6ScOG-0foiHGhN9myL5spI4,uninstalled undertale update buy again. progress gone.,3,0,3.9.0,2024-07-17 21:58:40,,,3.9.0
aaa7ba37-2078-409c-94f8-442e163c4d28,Jeremy Loveday,https://play-lh.googleusercontent.com/a-/ALV-UjWHFTL79S5wD5QrQd-3TNycYTD7ch9sG32s3m5rHO7WbJ_ob7GRig,"docked 3 stars 5 ""look game usage year"" notification toggle settings, ask it. seriously, valve?",3,0,3.3,2023-01-02 22:23:52,,,3.3
531a8e86-1898-4e74-8593-74069bf58ff5,Kuuhaku Desu,https://play-lh.googleusercontent.com/a-/ALV-UjW5Ialq97csGnyPj__3L9BtDCGoldmJuRBN3o87jr-5DG_uHuU,"steam guard verifying code sended phone number, click ""send code again"" code message recieved. try again, still got nothing..",3,0,3.0,2022-10-31 09:04:10,,,3.0
3ac30cf3-4653-467f-8df9-923b271aaea0,ilan liechtung,https://play-lh.googleusercontent.com/a/ACg8ocLHBButGpwCrYEGvUogYvMqHhdVJgYipXbMZCiOQn8faEA1Yg=mo,steam internet servers down? please fix this.,3,1,3.10.6,2025-12-25 03:17:01,,,3.10.6
b0928fa0-17ff-48ce-bb82-42518a0779e3,Jacob Mayhem,https://play-lh.googleusercontent.com/a-/ALV-UjU6F_ZKypBVV9PWM2XqbqTUJXXZjYb8mlwKgYJaYTZbZN_3boIV,uhm like... steam mobile anyway?,3,0,3.10.6,2025-12-20 10:38:15,,,3.10.6
b3fdd334-8abc-4f8b-a65a-f35715271982,A Google user,https://play-lh.googleusercontent.com/EGemoI2NTXmTsBVtJqk8jxF9rh8ApRWfsIMQSt2uE4OcpQqbFu7f7NbTK05lx80nuSijCz7sc3a277R67g,"new layout nice, clean organized. however, issues mobile authentication. show all.",3,0,2.3.10,2019-06-13 08:57:34,,,2.3.10
63ca7f36-a0b6-4ccf-b701-c30abf7a18db,Arianna Paine,https://play-lh.googleusercontent.com/a-/ALV-UjW9ptPq_jo6XJRwSEIbM9cVCWD1F-4NTUXUZFaSORYnbNsh-OEB,app used work amazingly. longer loads well allows buy games. go main site buy games now.,3,0,3.7.7,2024-05-01 10:40:41,,,3.7.7
c3cc2add-decc-47a3-80ad-65fab8fbb0d2,Artur Frycze,https://play-lh.googleusercontent.com/a/ACg8ocJXmFLXYCTULR2kC4bjRGxapbftIrBoAjnFBYub21m67LSb9MQ=mo,getting worse upgrade. see wishlist thumbnails anymore. prefer use steam website now..,3,9,3.5,2023-03-23 23:51:14,,,3.5
17b8ff4a-4fc1-4633-a3ae-6d3fa7652727,Andre,https://play-lh.googleusercontent.com/a/ACg8ocJxDXBpCTxS33uWW11FI2Isz7qMyHCqX0gMNFQW6cg7GSn9XA=mo,"display really bad. content ""fit"" screen. explore app indebt commit either.",3,0,,2025-03-24 17:32:28,,,
6b3812f1-5851-4276-8331-b324dfe2fab3,A Google user,https://play-lh.googleusercontent.com/EGemoI2NTXmTsBVtJqk8jxF9rh8ApRWfsIMQSt2uE4OcpQqbFu7f7NbTK05lx80nuSijCz7sc3a277R67g,"keeps saying ""wrong password username "" yet l downloaded yesterday first time using app please fix problem thank !",3,1,2.3.11,2020-03-28 18:22:46,,,2.3.11
c688035d-5db1-4c46-b2d4-7e8a781c5a66,Jacob Brown,https://play-lh.googleusercontent.com/a/ACg8ocLfue4FwZv8aXgl-1Fz9jTQ9eJvotRKMbW1G0irZ6mbFZujag=mo,normally works great. new update open app all. use steam auth anything,3,1,3.7.4,2024-03-22 07:32:09,,,3.7.4
1a021c9a-4bff-44f4-8eab-7965f771667a,Sir Pike,https://play-lh.googleusercontent.com/a-/ALV-UjU3xDRMbM1qEPl8ZWnp8ARskQhDvlPJjtyOX0S1y1dkVe9fPctN,took perfectly functional app broke 2 disfunctional pieces. half unresponsive pages frequently crash.,3,0,3.2,2022-12-24 06:50:46,,,3.2
9ff491ed-4ef5-4734-adc6-e7cfb22395d4,Joshuah Craddock,https://play-lh.googleusercontent.com/a-/ALV-UjVJMXrs8sdmdIIr398jDrnLg497ORHph9GYTM1QZL2zC4gdRowg,giving 3stars let make account one forgot making another account kept making sure human test. reset email again.,3,0,2.3.13,2022-08-24 14:20:02,,,2.3.13
3cbb9fa1-efa5-4eaf-baf1-90b646d3632e,A Google user,https://play-lh.googleusercontent.com/EGemoI2NTXmTsBVtJqk8jxF9rh8ApRWfsIMQSt2uE4OcpQqbFu7f7NbTK05lx80nuSijCz7sc3a277R67g,"come valve, please update app. got nothing crashes last 8 months trying opening store section.",3,1,2.3.9,2019-03-20 20:05:16,,,2.3.9
0a28e691-1e77-4e3c-b6bd-92542237da5b,Miles porter Cannon McLean,https://play-lh.googleusercontent.com/a-/ALV-UjW8uTT5WFZ3isoeSUpTxCFO_KDTAhoImCzrcIrcU4V7p0JuIfoJ,"screen big sign keeps telling ""to use past password use original account use make account all""",3,0,3.9.9,2025-04-27 02:28:38,,,3.9.9
930eb4dd-0862-4952-b178-94a0f8b1e951,Stan,https://play-lh.googleusercontent.com/a-/ALV-UjV0ZOqUSbZTg708VbS-8LtJtiFHdR5Z5vnuoNpDD38YFLJEsvky,"ok. slow, bugs logging out. good idea, good team, bad execution.",3,0,2.3.12,2021-01-20 11:56:05,,,2.3.12
d9fc7111-3d40-4249-900e-fb66a24e4a65,Tiyan Sebatane,https://play-lh.googleusercontent.com/a/ACg8ocKQYQmOwtpYuD-LVbW6AtdfM7-VmST4uiKm_Ovh3hA8N1kBLA=mo,great signing headache done signing congrats jackpot,3,0,,2026-02-28 15:15:00,,,
8d0af4c9-3465-4ef8-bcb0-f7042eb225ea,Movies Account,https://play-lh.googleusercontent.com/a-/ALV-UjWgditeSZ2TDkQJZ01BDBBJm9ikjDuhrKjmdtlAwf2p5RDnSYxFUw,"app horrible, capable things need steam phone app do, buggy sometimes hard navigate.",3,0,2.3.12,2020-08-07 00:05:17,,,2.3.12
