reviewId,userName,userImage,content,score,thumbsUpCount,reviewCreatedVersion,at,replyContent,repliedAt,appVersion
1abcfd95-905b-4ac7-a7ce-015712a5d3ce,Tykvesh,https://play-lh.googleusercontent.com/a-/ALV-UjW7pqDYkLoHOY5_DzQuPDTeDwzrw2lI-88iDF3WQWReOuwnvS9E,"reply push notifications include text, opening external steam links often launches app without opening link.",3,0,3.10.5,2025-11-29 23:59:54,,,3.10.5
f17c5ed9-7b89-4ad8-8018-24bba4853c74,A Google user,https://play-lh.googleusercontent.com/EGemoI2NTXmTsBVtJqk8jxF9rh8ApRWfsIMQSt2uE4OcpQqbFu7f7NbTK05lx80nuSijCz7sc3a277R67g,"problem app friends send messages notified. chance later date open chat menu, see new messages. please fix push notification issue instant messages",3,0,2.3.8,2019-02-04 11:05:44,,,2.3.8
c11ede90-a241-413a-ae32-85491330013f,Stormy Brave Riser,https://play-lh.googleusercontent.com/a/ACg8ocLmwT1ABQTo-uebGHtO10at9HVyAFBFpQ1l9fl9wRs4-snkrg=mo,need fix filter settings. set properly game pages still blurred images them.,3,0,,2026-03-01 04:57:27,,,
bb1f09f6-88ac-414c-a094-675fc20db021,Tree,https://play-lh.googleusercontent.com/a-/ALV-UjW2M7HXJOFI5n9t2UU0VtMOdMar9iSXDfZ_31hArcfxVqlJeww,"great difficult. good buying selling things fly, terrible trying access pc features. great security trading, terrible library status friend communication.",3,5,3.7.3,2024-03-02 13:22:13,,,3.7.3
93c4a02f-87ad-4324-b3e6-fe4352c7c16b,Buddy Rennie,https://play-lh.googleusercontent.com/a/ACg8ocIGXT02h-ci_YD2LMwf2ozKip0QGR7yv9tlsGb5c8_gYI-tkg=mo,"slow phone. click many options get steam guard code warnings need use code, logging browser qr code option code required still.",3,0,3.3,2022-12-31 04:06:25,,,3.3
b3f13a06-b750-446e-94af-2f17030bff7d,Johan Eriksson,https://play-lh.googleusercontent.com/a-/ALV-UjUBkMDosNFgjpN17E-jvoCa3bsEjX-RSq75YZ8sb6STQN1suQ2s,"like new update laggy buggy. really hope gets fixed time usable right now. lagging ok new phone, expect apps start lagging least year",3,0,3.0,2022-10-15 15:49:28,,,3.0
b382794a-0d24-498c-8097-3a955bf6d140,"Old Account, Still Used Sometimes",https://play-lh.googleusercontent.com/a-/ALV-UjVkkIxEJoJ0EPHlZUk8axQjXQ5EIiz7-xh2mWv7YUXB0xNzSdiM,"app looks like hasnt updated 7 years. quite useful mobile auth although forced use it, also talking friends go. rest plain useless. try desktop version. epic.",3,12,2.3.13,2022-02-24 19:46:33,,,2.3.13
1c710f01-949d-4125-a0b1-61b31c300541,Guillaume Ouellette,https://play-lh.googleusercontent.com/a-/ALV-UjVblL2Q1JT4eJKmhZrpdbm-GynLfRNo3Gy0gFCd2pbvWq5mxgMo7w,login screen show masked characters. seems accept character entry. goes captcha. says get wrong put correct characters. show characters. htc one swiftkey x.,3,1,2.3.13,2021-12-15 18:37:54,,,2.3.13
c4cfb388-7da6-41c2-b0f2-182369fe7b8f,Steve Marsh,https://play-lh.googleusercontent.com/a-/ALV-UjUS6s0M6BhpMO4dys-R5IQI0K6Z_5IVObVPzsayL40CBnxMCdK4,paypal feature broken.,3,0,3.10.6,2026-01-05 20:45:32,,,3.10.6
492ad983-593b-4288-b76f-331d8ae45b37,Rory Sparshott,https://play-lh.googleusercontent.com/a-/ALV-UjWlZqhczgFfFU1jz_-klQwLz9VeeBriLixa3enhBjBoSYM6Pgt9LQ,"bare minimum. optimised particularly mobile, basically browser window store. search absolute nightmare, hey, developed valve eventually updated sure it'll greatest app ever created.",3,32,2.3.12,2020-06-17 17:07:22,,,2.3.12
ec4ed391-880f-481b-a76d-222b9209d1e6,A Google user,https://play-lh.googleusercontent.com/EGemoI2NTXmTsBVtJqk8jxF9rh8ApRWfsIMQSt2uE4OcpQqbFu7f7NbTK05lx80nuSijCz7sc3a277R67g,changing password account app log in. prompted log back password change. says username password incorrect. logged steam computer issues.,3,2,2.3.11,2019-11-05 03:23:46,,,2.3.11
50338570-286c-4dfc-be73-fd5ab41caf31,D.,https://play-lh.googleusercontent.com/a/ACg8ocIS2ZmtFxoZtYTtXvUILqbRtIT1Oc2gqT-TBY08jWRlUssqDw=mo,fine part. notifications fail even permissions allowed phone connected damned router pc. love able game day off.,3,0,3.6.0,2023-05-29 22:21:00,,,3.6.0
15399dd8-0ca5-4511-b7c6-1f3b88079612,A Google user,https://play-lh.googleusercontent.com/EGemoI2NTXmTsBVtJqk8jxF9rh8ApRWfsIMQSt2uE4OcpQqbFu7f7NbTK05lx80nuSijCz7sc3a277R67g,"used mostly messaging, always inform new message arrives. also likes hyperlink words send messages entirely times. phone fine, new pixel 2 definitely app.",3,0,2.3.1,2018-11-12 21:38:39,,,2.3.1
14581b5b-b63a-458f-afa2-027330a815d8,Garrett Hunt,https://play-lh.googleusercontent.com/a-/ALV-UjXBK3butjJIZC5zOz9z9xTTfmhhk3LKfi4Q3AkA_sv4m6BsJfY,"ok. works shopping let complete purchase via paypal, like even bring paypal window. go web browser actually complete purchase.",3,0,3.3,2023-01-21 02:27:36,,,3.3
3fb8c3d4-1284-4179-87c1-8fc80f945f16,A Google user,https://play-lh.googleusercontent.com/EGemoI2NTXmTsBVtJqk8jxF9rh8ApRWfsIMQSt2uE4OcpQqbFu7f7NbTK05lx80nuSijCz7sc3a277R67g,"love steam app beyond flawed, lot things functioning intended. get notifications people inviting games, regular messages steam guard codes. pretty annoying honest.",3,0,2.3.9,2019-05-26 00:16:50,,,2.3.9
02eb17eb-15b8-41d3-9141-8955c3674f89,Ari,https://play-lh.googleusercontent.com/a-/ALV-UjWgvuaHq1ikkb3OyyqB0UtYjNFPWs-hCo_eIsCVQTujWzE7LbLo,love app hate fact tjat need pay $100 sell game. im poor game want earn money cant pay $100 sell game might even make half price. please lower rhe cost $15 under. plus people sell games steam steam devs make money too.,3,4,2.3.11,2020-05-05 09:00:23,,,2.3.11
8e23e219-f106-462c-bea4-1b2f2182d34c,A Google user,https://play-lh.googleusercontent.com/EGemoI2NTXmTsBVtJqk8jxF9rh8ApRWfsIMQSt2uE4OcpQqbFu7f7NbTK05lx80nuSijCz7sc3a277R67g,"sucks life battery. also search filter operating system almost invisible. really like able filter games based hardware configuration e.g.: gpu, ram, etc",3,0,2.3.1,2018-09-16 23:48:38,,,2.3.1
7375f244-6021-4e1c-bd58-9bc555869c86,G Flo,https://play-lh.googleusercontent.com/a-/ALV-UjVIXDyhTtLsBZnXMn1HmOciekMSPnBjaN--IOAZxKAR0J_yCTk6Mg,"tried refund game, get past ""my issue listed"" section, due technical glitch half bottom app covered way scroll past it.",3,0,3.10.0,2025-05-07 22:52:35,,,3.10.0
e6792a28-f730-47f4-8630-720dcc919d5f,Michael Sessions,https://play-lh.googleusercontent.com/a-/ALV-UjXr92l8V2qHOdjfc43Ib1rJw-cljs2ZcmXYd68Rj_Zef7aSBks,feels like copied controls iphone app. go back back button closes whole app matter are. use app buttons navigate.,3,2,3.6.0,2023-06-11 03:33:21,,,3.6.0
3dce8020-80bc-495a-8ecd-89bcd7d70288,Sems,https://play-lh.googleusercontent.com/a-/ALV-UjUxSHQdIMyhxZ0AydwJBsWYwk-crj6rGf-Ee9yEis_i-t15CrCf,"use time chatting checking sales. push notifications supposedly improved, ive missed notifications compared updated. also still support steam emotes chat messages.",3,1,2.3.12,2020-09-26 01:21:23,,,2.3.12
ceffccb0-15fe-4e83-a89c-34f568979a5b,Corado Cotuna,https://play-lh.googleusercontent.com/a/ACg8ocJKTyuHbEENV8i0NipUDB6C3I-pvT-R7rkE4UeYoUkjs77MWA=mo,"improvement, links steam keep opening previously opened page rather link actually tapped, screenshots always tiny viewed full screen",3,0,3.9.6,2025-01-10 02:52:00,,,3.9.6
307894fa-284b-4e40-961c-6ada356a9216,Dustin Baugh,https://play-lh.googleusercontent.com/a/ACg8ocID6yjDigNthxB64bTCZ9-hp2IHRY_ndAW8IYrjGExbq2AoOg=mo,looking way bypass abusive trash manifests mobile guess google intends prevent things accessible despite steam/valve capable providing access mobile devices desktops alike. shame really since games steam playable designed specificly empty bank account google forgot creed evil several decades ago guess par course now.,3,0,3.3,2023-01-08 04:48:43,,,3.3
d24ed2a7-6a31-4fb9-868b-55c5c17efc6e,joint ingridorchris,https://play-lh.googleusercontent.com/a-/ALV-UjUkKW8RzI5xx1sDjBBRK7EkzqAGPBPplczkjXazJY_8006umOA,new version app buggy. links frequently go dead clicking nothing. paypal integration longer works. pages bit slower load. galaxy s22 ultra.,3,0,,2022-12-10 00:44:24,,,
35b70f06-08bb-4e08-89e9-bf8984e45188,Lachlan Smith,https://play-lh.googleusercontent.com/a-/ALV-UjX7RLHWuWhIJzdclqNn3qOrblpRPLZ9ZyV7Yp6WArNd7TaoFpaf,"works right looking games stuff, kind useless. whole reason wanted skip type password pc find stupid code, waste time.",3,1,3.10.0,2025-05-16 07:32:51,,,3.10.0
d86458c5-25f6-4978-aa46-a738bb28ca1f,Ichthyosaurus,https://play-lh.googleusercontent.com/a-/ALV-UjUsiIeefVdGG5qcDJ83_S-s1Sg6wa8bf6egFxokVGWr7iUMfi1s,"updated: bit usable before, tweaks might necessary. - way refreshing page. - wishlist page portrait mode show image. - still problem triggering app external links.",3,1,3.9.5,2024-12-27 06:49:24,,,3.9.5
780cd301-3805-43c6-b007-74374377b169,malice,https://play-lh.googleusercontent.com/a-/ALV-UjWl4Ggyl06g5nSTW-LtN7Y2Q7Y4USnWYN46kqvIfS649d5E2s6U,app riddled sorts annoying bugs ever since day created. steam chat app works perfectly community features app has. hope valve stops lazy makes acceptable app instead beating around bush.,3,0,2.3.11,2020-05-20 06:24:28,,,2.3.11
5d1e1aa1-92ca-48c0-ada8-a1a146f7f440,Pete Dehaan,https://play-lh.googleusercontent.com/a-/ALV-UjWf-qJ6e5y6uv6dB9qnQ9XCez5Ft1uvuVowOOSjztjmI0FQzFco9Q,functional... great load app? see playing possibly buy games sale. friends list like hidden away even use talk people. least make easier get see playing what.,3,0,3.7.4,2024-03-31 20:04:08,,,3.7.4
3eec35c8-94c9-4db6-8c1a-5cb1f1b2a9a5,Jason O'Donoghue,https://play-lh.googleusercontent.com/a/ACg8ocKV3nyX4jriKTNCkbxlogq3dFR19IWINiiqFw9RQrUBeeKN9A=mo,"community forum topic lists borked year presents complete unreadable garbled mess. app pretty ok, expect apparent added security actually secure funds account - claims doesn't.",3,1,2.3.12,2022-05-04 06:55:33,,,2.3.12
9a576393-4007-4ba3-8aee-15d036eed7eb,Justin M,https://play-lh.googleusercontent.com/a-/ALV-UjVbv5qS7yB59wgMC4n2Qa23dlx4uoO1KYKHIOqmj_WwsmgBnCbd,"huge steam fan boy, wow, app garbage. many dumb things does. many list. wish every day upgraded old one. chat separate app? world may never know. give 3 stars *some* things better. few, some.",3,0,3.6.5,2023-08-01 20:18:04,,,3.6.5
9bb2b450-5c34-4dc9-a5a1-cff6182065db,A Google user,https://play-lh.googleusercontent.com/EGemoI2NTXmTsBVtJqk8jxF9rh8ApRWfsIMQSt2uE4OcpQqbFu7f7NbTK05lx80nuSijCz7sc3a277R67g,chat still bad many years. 'now typing' notification still causes scroll reset acts new message itself. least offer option turn off.,3,3,2.3.10,2019-06-29 06:07:36,,,2.3.10
d921b26e-e873-4826-bb50-8e7d68c852e0,Robert Stanley,https://play-lh.googleusercontent.com/a-/ALV-UjWknzecJvgMMKO7e7Fva4p4qHLZcdqvz9mjiCvbBXK1H6QzXCGD,"please fix back button design flaw...for love god! go back viewing game home screen, app minimizes instead returning home screen (not always annoying hell).",3,3,3.9.9,2025-05-06 20:55:14,,,3.9.9
4ce8a78d-c481-4506-832b-24c9799ed547,Paul Horan,https://play-lh.googleusercontent.com/a/ACg8ocISwmJ7mf_KJLNshbgPFxBth3GOlkuGXAMjnq4G9Hf8cylt_SJ-=mo,wishlist page entries enlarged couple appear screen time now. change compact mode save button options menu hidden beneath phones keyboard. frustrating.,3,1,3.9.3,2024-11-28 02:33:26,,,3.9.3
c7cf45de-0c58-4434-8aba-322e293fe8ae,PETER RAIN LAU,https://play-lh.googleusercontent.com/a-/ALV-UjWWcUfuMzHcMHqhfXvE_R78u8jXVq2nLM-eyNOS7RvmFnb6aSTnxw,"good keep games 1 site option, often problems sync saves two devices . cause frustration random event games games many micromanaging :-!",3,0,3.9.8,2025-05-05 02:00:20,,,3.9.8
acd0b814-bd63-495a-b022-74285b23f8de,A Google user,https://play-lh.googleusercontent.com/EGemoI2NTXmTsBVtJqk8jxF9rh8ApRWfsIMQSt2uE4OcpQqbFu7f7NbTK05lx80nuSijCz7sc3a277R67g,"dear steam developers, since beginning able change steam profile picture steam mobile app. click choose profile picture button edit profile page, anything. please fix bug. phone motorola g3.",3,8,2.3.9,2019-05-30 10:40:49,,,2.3.9
a33f5b01-827e-46ad-b438-824ae9cd006b,Jax Tannehill,https://play-lh.googleusercontent.com/a-/ALV-UjWSaqNeYX5JzliFGFZRTlgmZ-PdwKrMK0fu9VijaL1x9p9vUjm7,"works nice. currently even view wishlist profile set private, profile... gonna call glitch jus get games get home pc, deals still there.",3,1,2.3.12,2021-05-28 02:42:16,,,2.3.12
f36f787a-d4a6-41e1-b0a9-b90a51755be0,Skyler Miller,https://play-lh.googleusercontent.com/a/ACg8ocKFS-VxsL54qsAJttz2Bk3veluDVa7sMOPZwWRQNyrtlnfD4Q=mo,"ok exit app reopen it, restart everything done far tried recover password went check email security code restarted everytime couldent check numbers/letters",3,0,2.3.11,2020-06-05 01:44:13,,,2.3.11
a307b80b-40fb-40bd-9c38-72531feb8249,iDimitry,https://play-lh.googleusercontent.com/a-/ALV-UjXuKYub_VNX7O28fzux1HMmZ6QMxhYfC2plyKNpJ01hUU-C7U-Z,"steam error loging in. got message( many login failures network short time period.) connection good stable, wait 1 hour still send message time fix this??? tried re-install doeasn't work",3,16,2.3.12,2020-06-23 17:31:54,,,2.3.12
bc39a7ca-731f-40d3-9ef0-9937adedff98,DavidAlex,https://play-lh.googleusercontent.com/a-/ALV-UjUs1x9R-REqllJT6UflDpcNd8oRi8c6j2SplaP84b57VhYakKS4,good games make way remove trade hold individual confirmes via e-mail one logged in. market(especially cs2 skins) volatile lose money sometimes feature cant get rid even tho should!,3,0,3.9.9,2025-04-30 20:12:37,,,3.9.9
f7bbfe47-cf7d-4b55-b6db-67db2e48f915,Fynn,https://play-lh.googleusercontent.com/a-/ALV-UjWN_Kmc0SdHeUMN9ulrMAUwbm5EBj7mx_9mZold0YPEQ-Cs7pg,app works great far there's one big issue. look screenshots full screen annoying small phone. there's way make bigger turn phone sideways. please fix this.,3,0,3.7.2,2023-11-27 21:15:30,,,3.7.2
082ab33b-a83d-4411-8e22-944697a11c33,Adam Graham,https://play-lh.googleusercontent.com/a-/ALV-UjWO0LveLdn6Wyp2g5JQEIALZJuMD_gbT3U06lXnNxPnUnn3rP-PNw,good everything else steam get clunky app is. add damn back button heavens sake. seems matter page click back exits app completely takes way back beginning app. irritating hell.,3,2,3.9.9,2025-04-24 21:43:55,,,3.9.9
b9f30469-3446-411e-91f7-7afdbaf510e5,Kay Sorenson,https://play-lh.googleusercontent.com/a-/ALV-UjV-Cg2LD-daspPkPdaS3HQUm1wflpmGpvA7-r9SG8KQ3KWla9Y,let log like even give option lauch ap says join stream learn gives random info steam works sign options steam account need make another put email nothing need sign sign computer authentication code,3,0,2.3.13,2022-08-24 09:54:48,,,2.3.13
e4a85880-2ba1-4442-be3a-d36e2c3aeb29,Cristian Ghita,https://play-lh.googleusercontent.com/a-/ALV-UjVmwv2sR-6bqpPL3ImqE3c33xgducO3gy7xgyZoEwrh3DfL5W6N,"good app manage steam account, unfortunately, use purchase new game. required connect paypal account get never-ending loop requesting credentials",3,0,3.7.3,2023-12-21 19:52:22,,,3.7.3
070a0ec0-afcd-4bcc-b065-c154df506c64,Sirye Mccoy,https://play-lh.googleusercontent.com/a-/ALV-UjXXxb0E5pAbJTiEGxpag6c9tzseTuiKuv_4V4N33WivBvsNvJvp,"steam great problem. create account page username password enter. therefore, making impossible make account mobile.",3,0,3.6.3,2023-06-30 05:31:50,,,3.6.3
ba6a6883-ac93-4e7f-8729-11c3dc8152d3,Moon Spark,https://play-lh.googleusercontent.com/a-/ALV-UjU85UaHhYc-weJG-BLs1u0azY9gwm96LkBiXWO_ApHWkvdUXXk6,"adding payment method like using google play store credit nice, like pays app purchases direct credit card nowadays? 1-tap payment way faster convenient. app average.",3,0,3.0,2022-11-12 09:08:27,,,3.0
571c8bb7-112d-42d1-9e07-96fe01183b1f,Bergen,https://play-lh.googleusercontent.com/a/ACg8ocLNZ_h9Z6NVoeg7___-tUm9n63JkjLZcNACSBDksRZZ142WqA=mo,"make alot better, though biggest complaint (because barely use it) bug show actual playtime. ex: game played hundred hours shows 'never played' '0 hours' remote download uninstall works well",3,2,3.9.2,2024-10-28 07:21:21,,,3.9.2
d6a47c29-69d3-4acb-b1ef-0de9d8e7963f,Celeste Johnson,https://play-lh.googleusercontent.com/a/ACg8ocIBaiK0fHtk99CbIsvGXwSLjgw5i72wsTmafj97U20vfDl6iw=mo,"find hard navigate. reminds alot desktop version,, mobile friendly.. never know find community workshop items. account specific info.",3,1,2.3.12,2020-12-02 00:50:51,,,2.3.12
c6402414-eeab-4560-b603-50b299802620,Mark Hammond,https://play-lh.googleusercontent.com/a-/ALV-UjVZSReLx1JyZ0GD1CJgAXOTMwBvJG9PyEewA7D45Hf4UQCWqnr0Pw,getting push notifications turns turn-based games really aggravating find way turn on. want check manually app turn.,3,1,2.3.12,2021-04-06 12:56:34,,,2.3.12
718de29c-f166-49b5-9054-049a9ad18b46,vito,https://play-lh.googleusercontent.com/a-/ALV-UjUIv5uNmYMcLe1b14d_sAlB4zXWwO4q7zUIZZLz8D2BnXEg1phW,"steam giving error try log account, every time disconnect steam, stop trying log it, thing. fix changing password every time try log in, getting annoying!",3,0,3.7.0,2023-10-01 08:10:55,,,3.7.0
5928c5fa-ca21-4d4c-af80-e49f92c79a7e,Andrei Nicolai Casimiro,https://play-lh.googleusercontent.com/a-/ALV-UjUbHQcgPzlLdePQ_iv9JigR26ZzuCc-beE51Rjk7ZHPJDHxU4VM,"its... fine. love app better ui though. dont get wrong, using almost ui pc phone apps nice definitely saved lot hassle, features wonky bug sometimes. love steam though love games.",3,0,2.3.13,2022-06-23 00:46:35,,,2.3.13
d9ef585c-0510-40b6-8227-09e88e047f1a,Lisa Myers (LisaLovesYoux3),https://play-lh.googleusercontent.com/a-/ALV-UjVGrm-Yhl-_ucvzV064E86EGVMlX5t0oDliT-Qgr5z5ziUP-boUFg,"there's always something access. months ago activity feed. wishlist, worst time steam summer sale going. app needs much work, supposed to, job.",3,0,3.10.0,2025-06-27 00:38:26,,,3.10.0
fe2b35e4-451e-490c-8095-89384681ce53,Informed Choice,https://play-lh.googleusercontent.com/a-/ALV-UjVlrpR3bicNCWRkBYf3cJXcG0e_TGTRD4D5YouJQ3YSMnNhzx4,really frustrating messaging friends. hard nav message friends screen super easy click screen start over. please resolve awful is.,3,0,3.9.1,2024-09-10 19:50:47,,,3.9.1
e33b5338-74c9-4eb2-9a8f-80001a6d669c,Robin Pereira,https://play-lh.googleusercontent.com/a/ACg8ocIOmMP_TXS_hg1V99KuIlh66hZmO0RZiTSR9xw8ewdYfdDc5w=mo,"better. remember ap simpler gave option message friends one place. that's divided up. that's issue, update long time found this!",3,0,3.7.3,2024-09-15 10:56:58,,,3.7.3
659dbc72-68d5-4a79-b634-03fbcafe4c27,Leonardo Steel,https://play-lh.googleusercontent.com/a-/ALV-UjUNz608-CpBmjzU4nVdFXM8jLhintOlhZ_LstnDPvukGC8aSgMY,"introduction new ui, opening steampowered link app longer works. addition, trying search something results crash occasionally.",3,0,3.0,2022-11-01 07:00:18,,,3.0
9ec8fd53-77ae-44b0-8a78-971e837d43e0,Gustavo Bautista,https://play-lh.googleusercontent.com/a-/ALV-UjXKfrzf3746Ov6oUGpBMKie0ErtI4eIsB3pVdWceTm5CXLbeK9Zow,"problems screen size, need see font phone big size so, problem menu complete screen option scroll, see options",3,1,3.7.7,2024-05-15 07:30:41,,,3.7.7
1e09d2c5-4e4c-4607-a398-4257d60017fc,The One Guy Avanica,https://play-lh.googleusercontent.com/a-/ALV-UjWuXNG9UzUvtGJMxXkUcZCSWFLthdmkk2_iTy-iF3lM4geRdNSR,"anyone tell happening steam right now? suddenly log l log in. tried past 2 days still working far. always says typed wrong password cooldown, please fix problem steam....",3,0,2.3.12,2020-06-28 14:39:46,,,2.3.12
4e02e186-04de-4ede-ad48-8603c59b3db6,Matthew,https://play-lh.googleusercontent.com/a-/ALV-UjUls4N2ezENjtUplfumzZRfTAOgrP7aeiylR8EVx8OH4rF73OVa,"new app okay. think old version better, even though ""modern"" design. imo old design felt modern, everything efficient purpose. new version clunky slow. understand removing chat, even look friends profiles via app?? even chat app opens web browser view friends profiles. ""new"" versions apps people want always end worse original.",3,0,3.0,2022-10-15 01:07:51,,,3.0
e269776f-3e1c-477b-b315-1d8e0fcd4443,Guillaume Bessette-Picard,https://play-lh.googleusercontent.com/a-/ALV-UjXRxidRRlh0izEWVQa1nIpWi-9hjHrX1DGJQTI2h7eNFZZlIqDsOQ,"app improved, still lack basic mobile app navigation. ex: click game's detail page, use back button go back main store page, exits app instead..",3,0,3.6.5,2023-08-18 21:55:51,,,3.6.5
1c7adc86-f86c-432c-8f2b-4075177d3f84,Dexter Dextrow,https://play-lh.googleusercontent.com/a/ACg8ocKw1KFhyLx5-oyTBuocI1yTQ58FhqUGdyEARM2wwFOXlFZ36A=mo,"actually rather like latest update steam app got, find gotten better layout overall visually appealing interface. actual bollox separate bloody chat message app? integrate functionally, million years convince incapable that. valve developers many things, incompetent one them.",3,1,,2022-10-24 21:15:35,,,
14880338-4898-4aa4-86ad-67bdb0a0b145,Jim,https://play-lh.googleusercontent.com/a-/ALV-UjXO1wITAy_AUAE0kbsPePit-aEQ-5nf1T6mL0Ycsum13CS6CBpS,"good, missing important part a, pc...",3,0,3.10.7,2026-02-25 07:58:47,,,3.10.7
087a10d0-7866-457a-8a74-75fed0302ec8,A Google user,https://play-lh.googleusercontent.com/EGemoI2NTXmTsBVtJqk8jxF9rh8ApRWfsIMQSt2uE4OcpQqbFu7f7NbTK05lx80nuSijCz7sc3a277R67g,"change setting ""always online""? want appear online friendslist start app. looks like setting hidden something 🤷🏻‍♂️ p.s. still interested answer steam support (first message 29/11/19)",3,0,2.3.11,2019-12-14 00:37:41,,,2.3.11
f5b98c36-3e9d-4963-a7f7-ba94a53df613,A Google user,https://play-lh.googleusercontent.com/EGemoI2NTXmTsBVtJqk8jxF9rh8ApRWfsIMQSt2uE4OcpQqbFu7f7NbTK05lx80nuSijCz7sc3a277R67g,app decent last updated year ago. come valve. even updated mimic computer updates. u access group chats that's problems l. update make smoother like computer one. please.,3,0,2.3.1,2018-12-28 19:32:26,,,2.3.1
e8a7c8ed-9edf-458a-b19c-70981bdf64e7,A Google user,https://play-lh.googleusercontent.com/EGemoI2NTXmTsBVtJqk8jxF9rh8ApRWfsIMQSt2uE4OcpQqbFu7f7NbTK05lx80nuSijCz7sc3a277R67g,try use community discussions galaxy note 9 forums buggy mixed words title placements. mostly useful still read forums pretty annoying intuitive hope given smaller sites better layouts easier time use.,3,0,2.3.1,2018-12-12 07:04:07,,,2.3.1
4fade5b6-eda6-4117-bfe0-330d1ff84032,A Google user,https://play-lh.googleusercontent.com/EGemoI2NTXmTsBVtJqk8jxF9rh8ApRWfsIMQSt2uE4OcpQqbFu7f7NbTK05lx80nuSijCz7sc3a277R67g,"much. browser allows look account buy things. like see steam creating store android. port games linux, port games android. nice play console pc games android.",3,0,,2019-08-10 20:19:03,,,
f4631cb0-a9f5-4f6e-9abb-954b83954776,Sihab Shahariar,https://play-lh.googleusercontent.com/a-/ALV-UjU7od68BMTYjaTWRgs8xhrA7X7QJ55EdtG2Ptb2ZmH0lPj-elc2,experience steam mobile low quality. everything takes lot time load sometimes takes 2 3 minutes load. sometimes app take actions. think server problem.,3,0,3.9.9,2025-04-08 19:04:35,,,3.9.9
b001893d-2c37-4789-a784-793175ed5d7f,A Google user,https://play-lh.googleusercontent.com/EGemoI2NTXmTsBVtJqk8jxF9rh8ApRWfsIMQSt2uE4OcpQqbFu7f7NbTK05lx80nuSijCz7sc3a277R67g,"little suggestion. download app think purchace games using phone credits. support kind payment. theres chances reading review please add ""payment phone credits"" people buy games ease.",3,0,2.3.1,2018-10-12 20:20:30,,,2.3.1
af461de8-49ab-48dc-b90e-af970b95672d,Shadow Link,https://play-lh.googleusercontent.com/a-/ALV-UjWN2vGC2O5D3zyuOWErVrWk9prloBKPzwJmwGAIVbGZZsxUnqQ,love application think steam mobile version download steam games played phone really use steam link want leave laptop play steam link.i usually want play pixel art games hope get steam mobile version,3,0,3.6.5,2025-08-06 11:57:20,,,3.6.5
a18fd45c-495e-44c7-b9cc-930700d2969d,A Google user,https://play-lh.googleusercontent.com/EGemoI2NTXmTsBVtJqk8jxF9rh8ApRWfsIMQSt2uE4OcpQqbFu7f7NbTK05lx80nuSijCz7sc3a277R67g,giving three starts notifications pointless. thanks pointing item wish list sale. one? hundred titles wish list going make search one is? that's pointless.,3,0,,2019-03-29 21:46:31,,,
e07ffe77-fda7-4200-81c8-fbdb36291de2,flexep Lynx,https://play-lh.googleusercontent.com/a-/ALV-UjW2FFe1DY6zDf9LBgSQMgVrXhfKM7t3tFArDGuEhePEi9_tIkk,try create account working verify email work complete robot continue error pls fix update steam there's lot error create account😑,3,0,3.7.3,2024-03-09 13:59:14,,,3.7.3
035716a9-0579-414f-a023-3e0b6d94ac37,Nam Lê Văn,https://play-lh.googleusercontent.com/a-/ALV-UjWP7NlfxGBKJDQNqy8PcVLcE9rsdUjQattwoY9a701TfAkbIos,"problem recently purchase phone ""there seems error initializing updating transaction"". strangly, steam deck's destop mode works fine steam laptop works fine purchase well problem appear steam app phone steam deck gaming mode. please fix it.",3,0,3.6.3,2023-06-22 19:49:04,,,3.6.3
4aeaf510-8112-47c8-ab7a-844df0c35951,Kevin Quinn,https://play-lh.googleusercontent.com/a/ACg8ocLufzzMit7bennlzXBzrR1Wpub2ncFEU-AicIh-iWONvUpeIQ=mo,update fixed forum format devices made slow use. hangs lot opening link browser app searching games within it. older app needed tweaking worked.,3,126,3.2,2022-12-17 22:46:08,,,3.2
04a4ac90-7f0c-46fd-9e80-280d1d10371d,Matt Toll,https://play-lh.googleusercontent.com/a-/ALV-UjUX3NiN2i5dqSrJUeN6otigyF1GIzm-AIXtbHoWSfec2FUWprbG,"generally good, x box elite controller, button keeps opening big picture mode.. main button game... new windows 11 really bit issue needs sorting... let play games x box controller support mode",3,4,2.3.13,2021-12-26 14:38:46,,,2.3.13
9910544d-5f66-41c3-a4a7-0f6c63f4bc3b,Aidas Cereska,https://play-lh.googleusercontent.com/a/ACg8ocIVKmh_bLl5McmPDTvb_Ew4g2SW9rIa7VguUuuBJ7V_0R6tLg=mo,"works, great general steam usage know, late going certain menus consistently crashes app entirely, like viewing game list.",3,0,3.7.0,2023-10-17 05:03:15,,,3.7.0
ffd9771a-396c-4a2a-a364-1fb43f0d96a3,Damon Lam,https://play-lh.googleusercontent.com/a-/ALV-UjVmemZVGI2LvCW4i9urHdfDG3mcAkdJ8b3kUrqNoBrxjPETJDb8bA,re-install steam app android 4x times menus changing default language chinese even though set english. last time mixed english chinese.,3,1,3.6.0,2023-05-29 15:34:15,,,3.6.0
c11feb95-2870-456c-9ae6-b31543718d20,Mario Venancio,https://play-lh.googleusercontent.com/a-/ALV-UjXtcuXpgpEQj38U2lVWAYeb4II3skF5iUOLWWm9VhGbu1juHJm2Hw,enable transfer steam guard one phone even enable 2 devices. feature greater multiple account support.,3,1,2.3.11,2020-05-07 03:38:04,,,2.3.11
