reviewId,userName,userImage,content,score,thumbsUpCount,reviewCreatedVersion,at,replyContent,repliedAt,appVersion
1b0d371a-f289-4d22-9fcc-4ea9615ebb96,A Google user,https://play-lh.googleusercontent.com/EGemoI2NTXmTsBVtJqk8jxF9rh8ApRWfsIMQSt2uE4OcpQqbFu7f7NbTK05lx80nuSijCz7sc3a277R67g,see know rate that's sure good use play download games someone tell thanks,3,0,2.3.11,2019-12-05 10:46:08,,,2.3.11
d84dbee5-9211-4bd7-8da6-befd48340f87,David K,https://play-lh.googleusercontent.com/a-/ALV-UjXRsJzr9D1A3uxcGudquXf7mFmcspqSP84z4eaKvYAQR4SRgxVP,"getting ""got steam?"" pop-up mobile app signed account already? seems like steam already know whether account.",3,0,2.3.12,2020-09-12 23:24:55,,,2.3.12
0319a896-c0da-4a31-9c52-35ae50e9ea7a,Terrapin Flyer,https://play-lh.googleusercontent.com/a-/ALV-UjVK4cJ5HiolEQ_l5aPCnlWeUdKaWXYqdROuISSzriIZivjrMK8,"bugs: 1. back button exits app rather going back previous page viewing store listing. 2. horizontal scrolling extremely sensitive. simple swipe left right skip several items carousel list. many issues, ones exist quite frustrating. horizontal scrolling sensitivity seems issue long time now, support discussions read. back button issue new. using android 10.",3,4,3.10.3,2025-07-23 22:58:40,,,3.10.3
fb09cc6e-f2a4-49d0-9ec0-141b67ef30df,Reza Azura,https://play-lh.googleusercontent.com/a-/ALV-UjV4baKWEu8SErVwneLxa-QZ--OVWuiKfPB5cKcVIwzMZoQ3Bbps,store usually error like internet problem. need high speed connection? open store steam pc got problem,3,0,3.5,2023-04-16 15:33:04,,,3.5
b219a257-8b13-4f82-bea7-cc4ca248239f,Lavrov Vitaly,https://play-lh.googleusercontent.com/a-/ALV-UjX7dzxcUWwr1OsuZaA1LIhPKZehov4fgmCKYGY6CoJCa-vE1bbi,poor experience. probably provides good feature coverage ui outdated.,3,0,2.3.13,2022-09-15 05:09:56,,,2.3.13
b8bb63b9-4970-499b-8cc6-3d150ffc699a,Perry Jean,https://play-lh.googleusercontent.com/a/ACg8ocKEHdzurF69cph1KBABHrLrdgFC6yHI5NV2hKLBHdVVEQRThg=mo,new update optimisation issues. scrolling lags app making everything feel unresponsive.,3,0,3.0,2022-10-14 15:51:23,,,3.0
52cbed8c-bf48-44eb-a144-05373d1dd727,John Gehr,https://play-lh.googleusercontent.com/a-/ALV-UjW1-g9z7AVkwKtO8uMg8qgEciTz2HOmQfjLy2ys0gI6049hmrN9,update make worse. remove chat function app make separate app? that's assasine inefficient.,3,0,3.9.1,2024-08-31 04:19:16,,,3.9.1
3a352334-52f4-4c27-8fdc-a72c9ed66019,Aaryan Vij,https://play-lh.googleusercontent.com/a/ACg8ocKdowJ9uHOi6F1UAsh8lyFmJC-Zieq_7VsVRcRfQfX3UIixuQ=mo,log always shows wrong password even resetting,3,0,3.7.7,2024-05-04 21:10:08,,,3.7.7
8e4cedaa-0d24-4ddb-a4cf-b39798741c64,Jayden Thomas (Jaybest74),https://play-lh.googleusercontent.com/a-/ALV-UjUcbLJGQwWNnj8PcmaH_WxDadRMnscyXUTLTgDp5YTZTCcOECQO,love everything except link steam account google account get certain games phone.,3,0,3.3,2023-01-28 05:34:57,,,3.3
ce3e6163-df44-45fa-8ebe-663f7b316631,Leo Heart,https://play-lh.googleusercontent.com/a/ACg8ocJpERH93w9ttgt3JNdbjWsIxkNBNt1C3zatpYqA2z4KJUb94g=mo,asked confirm trying change password click yes reset password bedder trying pc steam app 😑 hmm dingo hunter,3,0,3.9.1,2024-09-30 16:08:28,,,3.9.1
fc1e323a-e056-4e22-a1b8-b9e51deee874,Nathan Fafard,https://play-lh.googleusercontent.com/a-/ALV-UjXUkiIUjlj8D2tFw3xdb2yGiMjrHp211ifeAk0eEdDUQxY2l1g,great app never lets sign password please fix,3,0,3.9.0,2024-07-09 20:32:34,,,3.9.0
cb522fbc-947b-4f68-9e80-7d3d0e5cc223,Trixie,https://play-lh.googleusercontent.com/a-/ALV-UjVqzHNOf1QrD_LMppvHu70RD67dcOiT_ddXtcy_h6OU2xVuEDAX8Q,"honestly know rate this. heard good things it, there's sign in, sign dont account. create one?",3,2,3.6.1,2023-06-18 22:48:55,,,3.6.1
100860e8-3051-4645-ab0d-fbf621e647c7,Josh Durrant (DJ -Bawnkers-),https://play-lh.googleusercontent.com/a-/ALV-UjUYPZDpDuz5c7mAo5hI7TdR-pSkasLTlBIQhGsT2kh9YEkUi-UZ,"hello, right using tablet bluetooth keyboard connected, supposed play games keeps telling need pc",3,3,3.9.6,2025-02-06 01:12:11,,,3.9.6
2761435f-cee7-445b-8a1c-de625fb1cc35,GOD RyuGa,https://play-lh.googleusercontent.com/a-/ALV-UjW90FmiJB5GlsXKWpC-YHEDgpaiAzbbN5B8W6Ey-nm6RYpZzJqY,good searching game comes back back button app automatically close,3,0,3.10.0,2025-05-04 10:55:53,,,3.10.0
c1c72d14-fb2a-4d45-8f33-7565594da467,Blake Elliott,https://play-lh.googleusercontent.com/a/ACg8ocJWzrT4NEp29pJg0FZvCjMIG_xVzk-SaP_vCFO64VGfTLWRtw=mo,"steam filter game reviews simply remove ones way related game, tired looking real reviews met unfunny idiots making nothing reviews life. worst part nothing reviews often highly rated awarded, never knew pc community filled sad, boring losers.",3,0,,2024-03-18 13:30:37,,,
1c77a48d-ca3a-474b-920f-29e5e24def54,Strider,https://play-lh.googleusercontent.com/a-/ALV-UjWUFKZdfTwTgrlNCZpmiSP64VLgqXGwj5DTpvYzXczrNPQpkVn0,yo steam got app said log account find button said create account,3,0,,2020-05-31 02:48:38,,,
aea89047-017d-438d-8674-f1564d770ba6,KhanHein Sam,https://play-lh.googleusercontent.com/a-/ALV-UjX_7_itsKCmFs1P1CKawnEv-KEwlAsjbZBYRS09n_BVTOBWw2I,idk app working out. tried many different times verifying gmail taking another website.,3,0,3.7.3,2024-03-01 15:40:27,,,3.7.3
80723330-9dc9-44c8-8676-d95879a0ca6e,Hamza,https://play-lh.googleusercontent.com/a-/ALV-UjWHXckcJha_s8TtuOMPQQ0Ec2qBT2uvdMT_izq_PH-5NJ7hqgG5,good sooo much bugs login error else 3 star rating high rate,3,0,3.6.0,2023-05-31 05:19:58,,,3.6.0
d041b10f-f627-4a73-a7ac-5993c6b502b8,T G,https://play-lh.googleusercontent.com/a-/ALV-UjXxo1mNz_RxBCHn855DSkB6pCln391g8r-Nf879MWd2pH5Dd9A,"one complaint app. forget password, try get code change said password. jump emails(on phone using said app) get code jump back steam app put code, starts log screen. go forgot password 4 options1)i forgot 2)stolen3)i'm receiving steam guard code4)i deleted steam gaurd mobile authenticator. coming back code?!?!?",3,4,,2021-01-30 13:36:02,,,
11b21aa0-1e70-4238-ab4c-b5e1fc0df799,A Google user,https://play-lh.googleusercontent.com/EGemoI2NTXmTsBVtJqk8jxF9rh8ApRWfsIMQSt2uE4OcpQqbFu7f7NbTK05lx80nuSijCz7sc3a277R67g,"try enter steam steam guard cant enter steam try get code enter steam said , problem comunication steam server sent code.........please solves fast important thing do.....",3,1,2.3.10,2019-06-02 08:49:06,,,2.3.10
ddbaf9d8-6d9e-4dec-9b3e-3e56d0115585,Vj Mavdog,https://play-lh.googleusercontent.com/a-/ALV-UjXrTn9-24s8XoFAcJF4XDj0cvp6j30GVy8G2_ufae2CByM_444d,bring back chat feature. people want app steam guard chat.,3,0,3.1,2022-12-11 09:55:42,,,3.1
6b3b5d70-8c9f-4e2b-8e3a-5bababe27206,Jason Fisher,https://play-lh.googleusercontent.com/a-/ALV-UjVmVUkV9Kcy4lTgiiN6uFU3JzJD-dIaRVuRX-dCd8hv2wbmRy80,"tried share game liked friend, hoping give easy way share link them. good idea it.",3,0,3.9.0,2024-07-22 03:16:19,,,3.9.0
9c4abb9d-f470-4247-b5ba-b7638f277ab1,A Google user,https://play-lh.googleusercontent.com/EGemoI2NTXmTsBVtJqk8jxF9rh8ApRWfsIMQSt2uE4OcpQqbFu7f7NbTK05lx80nuSijCz7sc3a277R67g,love steam update app add way view group chats here.,3,0,2.3.10,2019-07-01 09:23:25,,,2.3.10
5d99c8a7-508c-42b4-ac1c-e9517783a32a,Ian Hodges,https://play-lh.googleusercontent.com/a-/ALV-UjUoWa2jeWomOvDueGL0ic-2gZefFAxDAaz93mo9I6A1TXmULZH2,better steam steam chat separate. baffling decision.,3,0,3.9.6,2025-05-07 04:26:39,,,3.9.6
bb714407-4cb7-489c-bfa1-7029745e0c7c,A Google user,https://play-lh.googleusercontent.com/EGemoI2NTXmTsBVtJqk8jxF9rh8ApRWfsIMQSt2uE4OcpQqbFu7f7NbTK05lx80nuSijCz7sc3a277R67g,"add games library steam key. also, see games friends' libraries",3,0,2.3.9,2019-05-17 17:07:40,,,2.3.9
980b7e14-ec96-4e4e-8a12-b696076cfa0c,john lazaroo,https://play-lh.googleusercontent.com/a-/ALV-UjVEK94OKKh8L6OYaB7JmRxOuP5ly54mcAMGCbKfxYcJg3a96qO9,paypal android app worked years! missed sales this. please fix!,3,0,3.7.4,2024-04-11 13:08:28,,,3.7.4
32313717-ff38-473d-a922-98dde137d4d2,ABISHEK VRS,https://play-lh.googleusercontent.com/a-/ALV-UjX4wCRSJtjwi0vPU1IAiPlABcve-gWwuqn5aKkj_lndK3DieUk,bug allow sign family view,3,0,3.9.0,2024-08-03 00:10:23,,,3.9.0
924253e6-704d-4aae-b8f5-ff38049bef60,A Google user,https://play-lh.googleusercontent.com/EGemoI2NTXmTsBVtJqk8jxF9rh8ApRWfsIMQSt2uE4OcpQqbFu7f7NbTK05lx80nuSijCz7sc3a277R67g,really need update gui slow old looking.,3,0,,2019-01-14 05:55:04,,,
f2a5e5aa-29ea-40f7-9c16-cddf3bc3a840,Vimal,https://play-lh.googleusercontent.com/a-/ALV-UjWpJ4SQ7a-r1cXTgsep1_fNoyokMVBnyukNFazsxR-pYKi-sOv7,trailers app stutterimg lot even good internet connection.,3,0,3.10.5,2025-09-05 11:00:11,,,3.10.5
c3faaa0f-78ff-4ca8-99d9-18784878ae87,Josh47o,https://play-lh.googleusercontent.com/a-/ALV-UjUDJMQwjOCVcTkSBngirTKeYdmTLdY2taDWCc8YB9ssEtKA6bZy,literally failed login one time said failed many times...,3,0,2.3.12,2021-03-15 10:08:35,,,2.3.12
d22760df-d52a-40f0-9e09-d85bd53d14ba,A Google user,https://play-lh.googleusercontent.com/EGemoI2NTXmTsBVtJqk8jxF9rh8ApRWfsIMQSt2uE4OcpQqbFu7f7NbTK05lx80nuSijCz7sc3a277R67g,allow even give option create account. please eradicate problem. love use steam.,3,0,,2019-01-20 12:44:05,,,
9f31045f-366a-4db5-9523-4f1298120e62,CJ IS HITMAN,https://play-lh.googleusercontent.com/a-/ALV-UjW2hVQb5cWW7Qswb1L00qVw2je3BigifUSwLix7SH6VKUoH5Wk,changed app back 2022 yet still lags point optimized well,3,0,3.9.2,2024-10-17 23:01:24,,,3.9.2
4da3d917-5fda-4380-82c0-74c6b01727b6,A Google user,https://play-lh.googleusercontent.com/EGemoI2NTXmTsBVtJqk8jxF9rh8ApRWfsIMQSt2uE4OcpQqbFu7f7NbTK05lx80nuSijCz7sc3a277R67g,great able send attachments chat.,3,0,2.3.1,2018-10-28 00:44:57,,,2.3.1
35f89d49-ee00-44a8-b95e-3261d84027af,KUR1 S22,https://play-lh.googleusercontent.com/a-/ALV-UjUH9azCy6S8g5_yFnL1fSTNITpIxkOk4JD12VWz-eJe4RxYttLc,useful securing game acc specially u use anything!,3,0,3.0,2022-11-21 04:56:39,,,3.0
be506922-9865-47e5-8cab-29ad91ed1476,Deni Sinaswanto (denisin),https://play-lh.googleusercontent.com/a-/ALV-UjXRf5qvIi-_a_xGynRs72plw0EbfQWjcGHWbI0Wfuq7aFha0259hA,back gesture really unpredictable somehow chat message different app,3,0,3.9.1,2024-09-14 16:06:25,,,3.9.1
cc330997-7b42-471f-963f-e3aea869377f,Gennadi Koshelev,https://play-lh.googleusercontent.com/a-/ALV-UjWx986aXpImeQX_W_8tKvw3Y98bkzlh2kq1iUbZg7vMxwYQe1A,"2fa phone number requirements counterproductive, since relay sms. needing app 2fa instead already established protocols overkill.",3,0,2.3.11,2020-05-04 18:36:36,,,2.3.11
211c1d73-98e2-4c90-be39-09c04e7dc5da,A Google user,https://play-lh.googleusercontent.com/EGemoI2NTXmTsBVtJqk8jxF9rh8ApRWfsIMQSt2uE4OcpQqbFu7f7NbTK05lx80nuSijCz7sc3a277R67g,"enough functionality terrible ui. ui terribly unoptimised, alignment discussion threads comments severely broken. also, stop lazy. facing tough competitor pulls exclusivity force.",3,8,2.3.8,2019-01-29 17:58:37,,,2.3.8
42d6b5fd-a7b3-4474-af67-8b5888e9d443,Joycelynn Deville,https://play-lh.googleusercontent.com/a/ACg8ocLIU9h15yeR6MlNmxH-I5N9NlBhRBVsq8_vB74tXL1PiVwWAw=mo,"reall want enjoy it, cant. wasted 5 dollars terraria cant play it. wasted alowance. thanks steam thanks. plz fix 5 stars",3,0,2.3.12,2021-02-17 00:36:00,,,2.3.12
5da7aa67-f64e-4617-aa59-4b9fb8c1912b,Aleana Neely,https://play-lh.googleusercontent.com/a-/ALV-UjUHd5g7klis2nig2mvAwci3JTH3NCL7iDYN2Dusda95w2I7hF_0,hm seen steam overall think app good tells steam added device shortly waited still downloaded ima give 3 stars,3,0,3.7.7,2024-05-19 07:50:01,,,3.7.7
a3b71e47-cbe4-4d91-8afd-62a8ffbc0309,A Google user,https://play-lh.googleusercontent.com/EGemoI2NTXmTsBVtJqk8jxF9rh8ApRWfsIMQSt2uE4OcpQqbFu7f7NbTK05lx80nuSijCz7sc3a277R67g,give 5 stars recently problems. • market loading •when want add funds dosen't let me. ... please resove,3,0,2.3.10,2019-06-30 23:00:25,,,2.3.10
fcdd7790-ca92-4622-bfa1-b72a6b3f9432,A Google user,https://play-lh.googleusercontent.com/EGemoI2NTXmTsBVtJqk8jxF9rh8ApRWfsIMQSt2uE4OcpQqbFu7f7NbTK05lx80nuSijCz7sc3a277R67g,"like desktop steam, little slow.",3,0,2.3.1,2018-12-11 16:29:57,,,2.3.1
61e8b490-2d8b-41bf-82a9-e8206229cf0f,Sam L,https://play-lh.googleusercontent.com/a-/ALV-UjWqaA-xRL0O6C803xzvXjLYfroks6nXnYIQRQBQ1e6JAxbBYcbz,doesnt offer anything better logging browser,3,0,2.3.13,2021-08-18 14:09:14,,,2.3.13
907f11e1-a1bf-4cee-98b8-6ccf3ad9be20,Cherep,https://play-lh.googleusercontent.com/a-/ALV-UjWlzCZ578typV7VVTx0v42DPMtTiW-O5HRMKXU62NbPBlJA16wk,everything changed chinese. changed language back english. still chinese.,3,0,3.6.3,2023-07-07 08:48:02,,,3.6.3
d6698faf-298b-41f7-8c05-4a93e0e1bb51,Piatos,https://play-lh.googleusercontent.com/a-/ALV-UjUfvDOXO74t8AWETVoyVtnytb3ZG3HZGqduNL_Szr8jrsPZQJs,hey valve corp check auto chess moba imitating dota 2 smartphone hope u make dota2 smartphone convenient computer player means money.,3,0,,2022-08-16 08:34:02,,,
1200491b-40bb-4165-b4a5-4eaf66940dd5,A Google user,https://play-lh.googleusercontent.com/EGemoI2NTXmTsBVtJqk8jxF9rh8ApRWfsIMQSt2uE4OcpQqbFu7f7NbTK05lx80nuSijCz7sc3a277R67g,better back authenticator re-authenticate app wipe phone.,3,0,2.3.1,2018-11-09 11:20:49,,,2.3.1
1808b563-9113-4ba6-b92a-32ecfdbe0db4,A Google user,https://play-lh.googleusercontent.com/EGemoI2NTXmTsBVtJqk8jxF9rh8ApRWfsIMQSt2uE4OcpQqbFu7f7NbTK05lx80nuSijCz7sc3a277R67g,needs fix ui fit screen. especially like viewing inventory items.,3,0,2.3.7,2019-01-14 12:41:04,,,2.3.7
eab483a3-d6b0-4f3b-9559-8f303c5e3fd7,Gabriel Long,https://play-lh.googleusercontent.com/a-/ALV-UjVaBbOLhzl_RaIhPsVS6yY_cMae8f4AypJ6pZtpP4tJdEDfHkY,reason give app 3 star rating try play game say game downloaded couldet fine download game thats giving three star rating,3,0,3.9.6,2024-12-27 04:06:12,,,3.9.6
591cadc2-0923-4443-8ba2-bddaa0e9144b,Mahdy Saaed,https://play-lh.googleusercontent.com/a-/ALV-UjVIzu6zgj1RHJz1-jXkeSSwTprGAqEkeGgGqVipq_mL4ozGk3S8,nice app vodafone bill added app done egyptians buy games steam,3,0,3.10.0,2025-07-04 19:22:18,,,3.10.0
99046b87-8b12-4a7b-8467-53e69b7ab244,Dragon Dreemurrs,https://play-lh.googleusercontent.com/a-/ALV-UjXHFgYAbNxZ0oupt2ZYRbsAvX0RXbGQRjm-UO4MxLmBuJgfzIrF,buggy. refuse boot phone. fox bugs valve. please.,3,0,,2021-03-23 17:21:30,,,
95479fef-5042-4b6c-9d9d-8ce25edb5929,Mysterious Ervin,https://play-lh.googleusercontent.com/a/ACg8ocLyHn2oPSeyh5wXa0F-podJTtMdpyWK2HbMySudyIyv_bboLw=mo,cant buy steam market even though numerous listed number specific item,3,0,3.7.7,2025-01-31 18:15:16,,,3.7.7
e0056a4f-8a4a-4a18-bcf6-7a8feaf23aaa,A Google user,https://play-lh.googleusercontent.com/EGemoI2NTXmTsBVtJqk8jxF9rh8ApRWfsIMQSt2uE4OcpQqbFu7f7NbTK05lx80nuSijCz7sc3a277R67g,app ok takes top noch wifi discord work app store work donload games steam work plz fix,3,7,2.3.11,2019-10-01 21:30:41,,,2.3.11
b5e0c7d5-1960-444c-986f-e93f3af9bc8c,Timileyin Ajibola,https://play-lh.googleusercontent.com/a/ACg8ocIpC4jlpT_Z_f5-LzIj3CCNZSwpGv1o2PSnJJz5_KO0wikoUA=mo,rate 3 free never highest app ever downloaded,3,0,3.9.9,2025-04-28 01:14:34,,,3.9.9
5d04d0ba-ded2-47fb-ae59-6cd722b6d6fc,A Google user,https://play-lh.googleusercontent.com/EGemoI2NTXmTsBVtJqk8jxF9rh8ApRWfsIMQSt2uE4OcpQqbFu7f7NbTK05lx80nuSijCz7sc3a277R67g,updated fixed year.,3,0,2.1.6,2018-11-22 08:59:30,,,2.1.6
4b5387db-a87d-4a70-a240-3f3fec419ea3,Taves Jr Maciel,https://play-lh.googleusercontent.com/a-/ALV-UjW6zGM1Q38MJSfqNN98I48XFEaScnbF2I53xaR7qDU6GaSTlujC,"complaint fact auto update, making wonder locked account.",3,0,2.3.12,2020-11-06 22:12:36,,,2.3.12
4d2c350f-257e-4474-a4a3-ebacf7f6356a,Ghozi FS,https://play-lh.googleusercontent.com/a-/ALV-UjUhQajjEOdA3saNFjVbuSEENmh9WT-tTqkbWFPcWmafl60y7duv,"desktop design amazing, mobile app really confusing",3,0,2.3.11,2020-10-15 07:25:34,,,2.3.11
cf47d112-429d-4e1e-ae55-cce731c65234,A Google user,https://play-lh.googleusercontent.com/EGemoI2NTXmTsBVtJqk8jxF9rh8ApRWfsIMQSt2uE4OcpQqbFu7f7NbTK05lx80nuSijCz7sc3a277R67g,discussion forums text display correctlly. jumbled overlapping.,3,0,2.3.9,2019-05-31 10:40:24,,,2.3.9
0a536b53-b9f4-40b4-b930-dd25cf9f9748,Joseph Coleman,https://play-lh.googleusercontent.com/a-/ALV-UjXz_z4GDwMuHY_ET1YrXKmWi-BWMzHAdq0ddWbnXK2Ymm0cuArL,"please allow right half screen workshop shown, possible",3,0,3.6.5,2023-07-23 21:33:15,,,3.6.5
559308d4-3c57-4867-be67-35a705aeac6c,Huajain Iwnsin,https://play-lh.googleusercontent.com/a/ACg8ocKHwXxz9_njMPHTQBnxNX1KGYuXxDwxcrNCA-RrGokBtxwyUg=mo,"buggy, feels terrible, id rather use browser access steam web rather using this..",3,0,,2025-03-25 15:59:08,,,
ba4247fb-1ef9-4ca9-a67e-a6866e4bd3c9,Selvipriya Kannian Parthasarathy,https://play-lh.googleusercontent.com/a-/ALV-UjWIRipGxOFraeJV2_0PDT5fIxRlbYfdSEWhWxlpYHbw5izfE2t-BQ,computer broken. unable play mobile. please change allow play without steam link. quite unhappy 😖,3,1,3.9.0,2024-07-23 22:16:16,,,3.9.0
4b80a9bd-98c9-43f8-b909-28cd1d745e57,Lucas F,https://play-lh.googleusercontent.com/a-/ALV-UjXzoPJ0XpYkIneT6E5YzHZMkmT1npwKLxiTw3AmVuUCdGgFBJ9-RQ,navigation device back button needs improvement,3,0,3.10.0,2025-06-30 10:30:04,,,3.10.0
6b3e3599-3e8d-4ba3-a005-7e572e91859a,Alina Keerd,https://play-lh.googleusercontent.com/a/ACg8ocLB4AlFYwx1-Nndl1rEoXVze_0PAb8OOrmYYPPdjIni7yppKw=mo,please optimize phone samsung a51 new update optimizes good update qr codes also add plz function steam server tocken see work server also add edit server phone,3,0,3.0,2022-10-24 02:15:34,,,3.0
368236f0-288c-49a8-9659-a20b74d8a48a,anas tataoui,https://play-lh.googleusercontent.com/a-/ALV-UjVJnbrBf6-wU5Y5of5SNEXxkGD7-PRmIbMDXb_l-5icX6oCyZDb,somtimes bugs somtimes works shop screen,3,0,3.6.5,2023-12-09 05:46:26,,,3.6.5
4c7f03e1-757f-42a9-970a-73257241eddd,Jenn Le,https://play-lh.googleusercontent.com/a-/ALV-UjW8msf5acnRyqIxm2QodASX2tSBePAs1dwYUzUlg1o3tVYAD6po,"share button facebook, twitter, reddit? share game/steam url way like chat email? want grab link steam game page",3,0,2.3.12,2021-02-11 04:05:11,,,2.3.12
633d338c-e4df-499b-a028-75247f71502d,Matej Kajan,https://play-lh.googleusercontent.com/a-/ALV-UjWUc9pHKog5GFCS23TZVYVXvNGAINtP9BoDR1TfwyH7e5_l9cA,"working moment, someone steal acc steam app shutdown houses burn.",3,0,3.6.8,2023-09-14 02:03:54,,,3.6.8
e802722c-8705-4690-8b76-1902205acd02,A Google user,https://play-lh.googleusercontent.com/EGemoI2NTXmTsBVtJqk8jxF9rh8ApRWfsIMQSt2uE4OcpQqbFu7f7NbTK05lx80nuSijCz7sc3a277R67g,need better like share photos files,3,0,2.3.8,2019-09-08 04:29:50,,,2.3.8
5e97b085-b035-4b8c-a81c-9429ddade658,A Google user,https://play-lh.googleusercontent.com/EGemoI2NTXmTsBVtJqk8jxF9rh8ApRWfsIMQSt2uE4OcpQqbFu7f7NbTK05lx80nuSijCz7sc3a277R67g,cant add friends sometimes widget steam guard doesnt work,3,1,2.3.8,2019-01-19 15:52:20,,,2.3.8
e39db806-7d97-4f3e-ae9d-c42ed04e1a50,A Google user,https://play-lh.googleusercontent.com/EGemoI2NTXmTsBVtJqk8jxF9rh8ApRWfsIMQSt2uE4OcpQqbFu7f7NbTK05lx80nuSijCz7sc3a277R67g,app alot useful actually see group chats,3,0,2.3.1,2018-10-09 21:17:53,,,2.3.1
a557d3cc-9557-416e-86ae-c0b18bdda457,Jay Lonio,https://play-lh.googleusercontent.com/a-/ALV-UjVq8pkM-AbfVNRxwYcbjv3dBOJXcUWHb0tNM_hc3DNb7phFDOI,opening app glitchy sometime even open,3,1,,2024-04-18 12:51:37,,,
9346cc9b-d08d-4ce4-8d1d-33147b99ec63,Melvine K,https://play-lh.googleusercontent.com/a-/ALV-UjUffiCACKnPqe7iHrwWXql4NUBA_tztdx_siQIB08XtCh_1yh7e,login issue. keep saying login already login,3,0,3.7.3,2024-01-16 21:09:46,,,3.7.3
0861ef40-6858-4583-9e93-0edf964465e9,Rian Childress,https://play-lh.googleusercontent.com/a-/ALV-UjWz3rn8U42Vp5dAY5Jxz6ReAlPJJBjtBNKHM-kZLOqqH1mV5d1y,old app used able trade immediately trade anything,3,0,3.0,2022-11-12 13:38:24,,,3.0
0edef54a-5d72-4baf-af03-8231192fd359,A Google user,https://play-lh.googleusercontent.com/EGemoI2NTXmTsBVtJqk8jxF9rh8ApRWfsIMQSt2uE4OcpQqbFu7f7NbTK05lx80nuSijCz7sc3a277R67g,app needs notification oriented..like messeges notificationsi guess,3,0,2.3.9,2019-09-03 12:25:58,,,2.3.9
2bb0f97b-afb5-40f3-b6bb-b7998622c5f8,A Google user,https://play-lh.googleusercontent.com/EGemoI2NTXmTsBVtJqk8jxF9rh8ApRWfsIMQSt2uE4OcpQqbFu7f7NbTK05lx80nuSijCz7sc3a277R67g,"got new hp stream 14 laptop christmas think version app made available download since website allow install steam software it, like microsoft allow somehow safely download steam software laptop",3,0,2.3.1,2018-12-27 06:43:00,,,2.3.1
18834e0d-bb8e-49cd-b38e-6527d470a5fe,Matt Vesel,https://play-lh.googleusercontent.com/a-/ALV-UjUb4nhBqk-QGaYmXpIx042b3jwUk9O6oC9exadqhYIJ2BpBYeqW,basic app convenient something goes sale home.,3,1,2.3.12,2020-12-13 07:08:48,,,2.3.12
35b001b3-48a3-41b2-b215-f904be13b3d4,Yukito Yukaza,https://play-lh.googleusercontent.com/a-/ALV-UjVx4x9Ss_L8aiuFjguT8_zJ2F-WJTp-wMWcjv0zd3VePzGPhcHP,kept crashing steam guard log steam account.,3,0,2.3.12,2021-03-23 14:28:23,,,2.3.12
9b233d43-232d-4fc1-8e22-dd883acaf639,uihs,https://play-lh.googleusercontent.com/a-/ALV-UjVBLa3j5sIDMz4OXKPii1pxzs7T_xFt9-bYVV_KgVoWCDRxBnhQ,"okay guess, problem ""go offline"" work properly",3,1,,2022-10-05 16:32:52,,,
8519c8d0-fd2d-4349-bca5-086287a0e0dc,Naman,https://play-lh.googleusercontent.com/a-/ALV-UjUONZQ7kvSR2JpV1foya1t-qUIsJMvrNRxIx0hg48AGc_eD6B6SWw,bugs loads slow sometimes unable load inventory,3,0,2.3.12,2021-01-10 22:14:52,,,2.3.12
e4141b6b-6557-4ce6-85a6-f248a67504d9,beuue,https://play-lh.googleusercontent.com/a-/ALV-UjWPdvoVxPWa4mTtFYxtVWihOjw0Ja4LBH0wA9-tfbnakoD9oUna,"nice update ux, lots bugs system instability",3,0,,2022-11-04 18:37:34,,,
d6e49aac-91bb-4013-b269-0b4ded6d2e0a,Daniel Cruz,https://play-lh.googleusercontent.com/a-/ALV-UjUW4iqgdiUGz-EyswL_1tmQ-fDi3jRrT3IrdbnLOsbJRCAFaU_z,organized bit hard navigate,3,1,2.3.12,2020-06-24 10:23:26,,,2.3.12
13205d8e-329e-4326-8cc7-84630e4f0871,A Google user,https://play-lh.googleusercontent.com/EGemoI2NTXmTsBVtJqk8jxF9rh8ApRWfsIMQSt2uE4OcpQqbFu7f7NbTK05lx80nuSijCz7sc3a277R67g,"great browsing store, cant edit account look library",3,1,2.3.10,2019-09-26 18:03:22,,,2.3.10
f88c4c12-0e0b-43a5-a01b-c5f7f6ba4831,Nafiur Rahman,https://play-lh.googleusercontent.com/a-/ALV-UjV9AEWkGKaLE3k5joJ26V2JgDRUP-h7zB7_uue3oRJKfuFA15aP,community market load....even cant open inventory stupid errors.,3,0,2.3.12,2021-01-26 14:03:19,,,2.3.12
8e779f89-b60a-415e-a890-5d8d9ebb145a,Addison Coleman,https://play-lh.googleusercontent.com/a-/ALV-UjWbN0QK_shVCpBbUS16_y5xplYiupbJfhhzXp54GShQoIMnH7aJ,account remember email phone number let create new account love know make one,3,0,2.3.12,2020-09-20 00:54:51,,,2.3.12
5eab908a-394d-4c5b-9c15-9ba4c40d3c1a,Fnaf Fan,https://play-lh.googleusercontent.com/a-/ALV-UjXoEkB8bAhQQf-uZHkr14R4tJTfPz-ofseHalxGqBkQnmtaZ7U,like wish pay google play good app :),3,1,3.6.0,2023-06-09 14:44:05,,,3.6.0
058dc7c9-3240-4e08-9d1c-509efb3a5c2c,A Google user,https://play-lh.googleusercontent.com/EGemoI2NTXmTsBVtJqk8jxF9rh8ApRWfsIMQSt2uE4OcpQqbFu7f7NbTK05lx80nuSijCz7sc3a277R67g,chat needs major rework. general usefulness rather limited...,3,0,2.3.1,2018-12-12 01:47:43,,,2.3.1
1f5ffdaa-34c5-4d53-a646-13c1af5529b1,Sharif Ahmed,https://play-lh.googleusercontent.com/a-/ALV-UjVnthEEshw5eVC4yqOWweU1fcGKbJPyJpfYs-8d7rzbcRh8pmE,every time made new windows got error loge make new account downloaded app log qr code made new windows laptop us qr code take long time log please fix qr code tell us stop using steam,3,0,3.10.3,2025-08-10 11:07:39,,,3.10.3
f257a0ed-4e3f-4bff-86a6-776bf748daee,Kage Kazama,https://play-lh.googleusercontent.com/a-/ALV-UjWN0MZG5eckRDIkW3T9bBeeFCCzVzUI1HO4alWG8sCvGd_CYOc_,something wrong scan qr use steam guard code please fix,3,0,3.9.1,2024-09-09 10:36:00,,,3.9.1
cd325a36-afaa-44a4-b87d-c09b0a2dd658,A Google user,https://play-lh.googleusercontent.com/EGemoI2NTXmTsBVtJqk8jxF9rh8ApRWfsIMQSt2uE4OcpQqbFu7f7NbTK05lx80nuSijCz7sc3a277R67g,"app needs send sms permission, enable steam guard authentication account",3,0,2.3.11,2020-01-30 09:07:14,,,2.3.11
49b8f17e-90eb-4a6c-8293-666e08390bf2,Brandon,https://play-lh.googleusercontent.com/a-/ALV-UjVvdBRs1p8MIBRUKjfJ8BVYIFruLCx22OLIV-8V2Anlqot6G7dD,good computer time usually use thought,3,0,2.3.13,2022-01-16 18:49:48,,,2.3.13
0f62bd16-5348-49d0-8da6-3e1d7321a4e5,Matthew Cupido,https://play-lh.googleusercontent.com/a-/ALV-UjU1qJnhIJOExdX4hD2eaL_NaeirHv953tbqNbkQkRF49Txkc70,decent bugs. improved.,3,0,3.9.0,2024-07-15 04:56:01,,,3.9.0
5c01e3fd-d436-49e7-ab1a-fb354db5c0b3,Ariq Abdillah,https://play-lh.googleusercontent.com/a-/ALV-UjUzkef-VNPVliQhNxp0KWtL-0qOEEDG0JK2heEazn9Lh8d31A1p,"bug, owned game cant see library",3,0,3.9.1,2024-12-10 08:48:06,,,3.9.1
2e6681f9-bf79-41a4-9099-17c4634d895a,Matthew,https://play-lh.googleusercontent.com/a/ACg8ocJSPY3LbJdHyhOdB1fi5yRngaIapks6c43f-jJJ5mrhVI_F4Q=mo,like thing free game like gorrila tag cost money whitch annoying,3,0,3.9.9,2025-05-01 09:23:34,,,3.9.9
6e3956ae-a419-40db-bd62-ebc7d269175f,Funyeeluke 5118,https://play-lh.googleusercontent.com/a/ACg8ocIkeed2QhcV3QBXLXc9kiGAKPiKzRSXTrUyUY-Shk9XOXfiAA=mo,"steam cloud always error, frustrating",3,0,2.3.13,2022-06-09 16:40:12,,,2.3.13
5641a518-5766-4b45-8a1e-cd68e1e9a317,A Google user,https://play-lh.googleusercontent.com/EGemoI2NTXmTsBVtJqk8jxF9rh8ApRWfsIMQSt2uE4OcpQqbFu7f7NbTK05lx80nuSijCz7sc3a277R67g,"needs polishing, year updates...",3,1,2.3.1,2018-12-21 22:03:06,,,2.3.1
6490a571-568e-4bc1-be8c-27e99b680b7d,Calvin,https://play-lh.googleusercontent.com/a-/ALV-UjVnznpY9eSPquMVAQyNn3dfObDMcM8m9kft8jzYy2fui8aGoS82,"removed chatting, forced install chat app keeps disconnecting.",3,0,3.0,2022-10-14 20:59:32,,,3.0
e3ae1f41-0936-4ea6-8fe0-de28e3bc9552,Austin Osgood,https://play-lh.googleusercontent.com/a/ACg8ocJLWkSws9fmjd1Y4WMA74mB1sfMippJOTqBfEAahPiLZfmgnA=mo,needs desperately google authenticator,3,0,3.10.7,2026-02-25 21:22:54,,,3.10.7
e25c5859-9e5b-4846-afe1-9db21eeedcb5,Berserk,https://play-lh.googleusercontent.com/a-/ALV-UjVACA61-99RCuJFiYCNv9mwoMsJNc7_WnDg1Xpv7B38wSJxlwDw,optimization (everything takes long time load),3,0,3.6.0,2023-06-01 13:47:45,,,3.6.0
