reviewId,userName,userImage,content,score,thumbsUpCount,reviewCreatedVersion,at,replyContent,repliedAt,appVersion
1dd79e79-2398-4946-8081-bff5e9e50280,Gideon,https://play-lh.googleusercontent.com/a/ACg8ocImwGipvvCXAP_eWrNiZRqvvRuG3pk3IyYJGuCEItzr-WNL3A=mo,"great stops working. every awhile ""logged in"" relog in. due server issue. website issue, automatically redirect broken application select something. steam guard compounds problem. desktop application website seem much better platforms.",3,8,3.10.7,2026-02-24 07:43:53,,,3.10.7
c4113edc-cbad-46c0-8580-df27a577ebf5,Bryson Carlton,https://play-lh.googleusercontent.com/a-/ALV-UjWuExRc6FI1bIMXcJHNMF206wQ5qufwdcFVATwObFiXObgoWcgs,"old app, see friends online, message them. need use inferior steam chat, separate app? that's annoying. sure, new ui pretty, bit gained functionality, lost some. edit: friends list little buried. like available tab bottom, checking online commonly used function using app.",3,183,3.0,2022-10-23 23:51:31,,,3.0
a0d65bcf-3dd3-4b76-831a-9906271adc86,Pirate Piccolo,https://play-lh.googleusercontent.com/a-/ALV-UjXMouU4yBUWVCi7IClNiExZv6-VNP7u6GwfPM73hWdBCOIQm7M,"app nice check games desk, always issues, seems. app taking forever load even good connection, half screen blocked grey bar, tapping something multiple times opens, issues. way least year, idea issues resolved. internet speed fine to, assume app.",3,762,3.7.3,2023-12-31 11:16:41,,,3.7.3
78ea4d12-60fa-4215-847c-f7d9582f1dfa,Ben Newell,https://play-lh.googleusercontent.com/a-/ALV-UjU-NWdnCZiGVMos6L4pIKnOxLZEpSL0-tEI3zI7LOhfDPvuHDNb,"work sometimes. presently set 2 factor, (from app) tells need install app, sends play store ostensibly install... itself, course option play store. try click done, silently fails out. eventually figured second place go set 2 factor, worked, ux awful. presumably app web browser.",3,145,3.7.7,2024-05-17 04:11:53,,,3.7.7
221a0ae1-c88c-4878-b9db-216e0bc364a0,A Google user,https://play-lh.googleusercontent.com/EGemoI2NTXmTsBVtJqk8jxF9rh8ApRWfsIMQSt2uE4OcpQqbFu7f7NbTK05lx80nuSijCz7sc3a277R67g,"supposed do. buy games, chat friends see library. thing severely lacking mobile app version (at least samsung note 9) forums section. atrocious unusable. words overlapped; see topics. hope feature gets fixed becuase use lot.",3,263,2.3.11,2020-04-19 16:15:30,,,2.3.11
99762831-de5c-4149-8525-4213599f32bb,Elu Niu,https://play-lh.googleusercontent.com/a-/ALV-UjVLXO9fwD3Hy8HJttZ_Gni6-Ekl-kXkA2_p3sqYh59AQJd-UwYR,"okay omg way way way much going everywhere. fact 1000 options individual friend profiles none view wishlist weird me. general lot going without much method making difficult navigate. otherwise, runs decent me, arent really major issues ive run far.",3,5,,2023-12-26 11:59:03,,,
3f64489d-0b8d-4be1-8d94-af51a0dddfe0,Hrishikesh S,https://play-lh.googleusercontent.com/a-/ALV-UjVvyFgA2G_F1pWsJcXcHL30seUgVI2Gakad34Jh9f_6lb7P88E,"fix android steam app. games library cover page title written making difficult. always open gray box see game name library. app slow even high speed internet connection let searching games, loading detail game search, image loading etc. everything damn slow.",3,12,3.10.7,2026-02-22 06:12:16,,,3.10.7
d8c5e843-a1da-4272-8770-0b35b947e427,Dylan Harvey (MinigunnerConner),https://play-lh.googleusercontent.com/a-/ALV-UjULDVJGfA9YeGcsAXaEyqS6GZK-sMv_PVRkUj8NLmpQ7DnxB3yQ,"good app convenient use. well, except one small problem. paypal worked knows long unable purchase it, forcing use steam browser instead, annoying.",3,0,3.10.9,2026-03-07 08:12:26,,,3.10.9
b77d5992-d6cd-4ad4-8d8d-3b0d7e03c13f,Thomas McDermott,https://play-lh.googleusercontent.com/a/ACg8ocJ4E-fe7cd365B3SmXV55nPmtQaZC4m_pw1TfbHnhZB_ZeNGQ=mo,great installed sake keeping account secure purchasing content away pc. wish application overhauled something much better (more efficient less clunky mess) future.,3,4,3.10.7,2026-01-24 08:43:20,,,3.10.7
7a606633-8f3c-4587-b21c-277e019a865b,Alessandro Bucataru,https://play-lh.googleusercontent.com/a-/ALV-UjXMxpXMkqaPm1u0G5jcg6W3t4ZpF6wHWoemwH8YCXCGAZLieiI,"app great, dont know steam app, keep needing sign even though 50 times time leave app, cant add steam guard thing press retry button, send back steam guard keeps repeating. im trying recover account pc since dont wanna spend 21 pounds game!",3,14,3.10.7,2026-01-30 04:36:17,,,3.10.7
8a33d9b6-9527-49e2-afbd-71eb36634219,Addison R,https://play-lh.googleusercontent.com/a/ACg8ocI-cO9k6Db9kiVz3PigkLsmtCs0eCf1MOzhgExNSRNc6Ow28g=mo,"logging constantly, connect library, says error occurred adding account steam guard... already setup past. basically acts like im signed despite signed in.",3,0,3.10.7,2026-03-02 10:23:26,,,3.10.7
58445d38-a6cc-40f5-ae46-e6d4860e9370,Priyansh Pawar,https://play-lh.googleusercontent.com/a/ACg8ocJ12lTv30dbzM_XTJbuw_8dxf00EsyCaz-tGdHJ_JWK9k2c_DU=mo,"steam platform great, mobile app inconsistent. library often fails load ‘oops, something went wrong’ error. works, it’s useful. doesn’t, it’s frustrating. stability seriously needs improvement.",3,9,3.10.6,2026-01-12 12:06:49,,,3.10.6
38fb1fec-86d0-4487-b8c1-8561fb70738f,Robin Eden,https://play-lh.googleusercontent.com/a-/ALV-UjWfG9L58uQYaN-3GdbO5VtJwUySZWArycOEhp6qQuoD0EiVIam8tQ,"please improve navigation back button works correctly consistently. please start opening game pages new tabs windows check title, return place list. clunky inconsistent. almost infinite financial resources. better.",3,0,3.10.7,2026-02-25 09:55:27,,,3.10.7
35a84e99-0294-4263-ba16-620b95edfae1,K W,https://play-lh.googleusercontent.com/a/ACg8ocLLk9TvNovOQFLg5VfxOX0e7FrSk80u3TNEr7PhmNmMr-FFLw=mo,"app fine, clear menus navigation. issue lies occassional disconnects, particularly annoying regarding steamguard 2fa. (despite adjusting app regarding auto manage permission removal/deep sleep) experience varies issues presented logged off. logging either solves issue validates current session (with occassional desyncs games & friends showing 0 wrong numbers, fresh install required)",3,1,3.10.6,2026-01-24 07:06:32,,,3.10.6
b263e0b0-6ecb-4bf8-bd9c-dc3302740678,Blank,https://play-lh.googleusercontent.com/a-/ALV-UjWgkGEOX-gribPhyR993RYJcMO0VxYAxM8DU0ltuoUNVeA70ylp,changes ui overall design worse years ago is. app runs well job protect trades account.,3,0,3.10.9,2026-03-07 02:30:58,,,3.10.9
a4d4af55-75d6-4d5b-b2f3-9e1bb5bf594c,Beanie Eme,https://play-lh.googleusercontent.com/a-/ALV-UjX9KoDlavPwrJnSMp-WmoyZ3mZBRDJyV9kKX1cd-fL5hbfWLUrXzg,"give 2½ stars could. love stream, recent update logged out, fine, logged back easy enough, whenever open app, store load unless hit refresh, even closing app completely.",3,8,3.10.6,2025-12-25 16:06:53,,,3.10.6
2a76f62b-777c-43d4-9fad-51945cec187f,Erik Lentz,https://play-lh.googleusercontent.com/a-/ALV-UjXiw_R_Cy46yLQ6fl3YtUsuvpk_qJ4KY-sbtAvaZgyntnkRUf8v2Q,"generally works shopping games, viewing library, trading market content. ""community"" feature full pornographic content there's basically way save without blocking ability use platform entirely.",3,2,3.10.6,2026-01-10 18:37:09,,,3.10.6
e2faa957-c098-4519-9493-87f3a9378d0b,Brenden Davis,https://play-lh.googleusercontent.com/a-/ALV-UjVUb8clTjINcld9V3ByqEHXXdISBF29WlUt2zFdMGlZi-gqJ5s,love game customer service need serious help bought game charged said card declined possible sent email telling purchase price excluded charge lost 21.94 helldiver's help please!!!!!!!!!!!!!!!!!!!!,3,0,3.10.7,2026-02-03 01:02:37,,,3.10.7
b7407714-fc24-4756-b6f1-6b5f83c3e521,Samuel Holland,https://play-lh.googleusercontent.com/a/ACg8ocLnrUlB8iXYGwSo46aJRouoL9jG5ylp-_Q4KkQ4P7R-3rV-77N8=mo,"nice 'works' (signing in, etc) longest time, app using paypal, goes to""enter email etc"" loops; log chrome make purchase. app works sometimes.",3,0,3.10.7,2026-02-05 10:50:49,,,3.10.7
f3bd92e8-da9f-42c6-af9f-41f7e815715a,MINOTAURS IIV,https://play-lh.googleusercontent.com/a-/ALV-UjUrUDjbx5jB87dv507WepWXYzxPy9ODlilIk-la8FlDgWpwbkTf,"want check particular item details steam community market pressing particular item, wont expand item show details anymore! dont know what, browser steamcommunity page. :(",3,0,3.10.7,2026-02-23 19:22:00,,,3.10.7
fe99e0ba-abd4-4e5a-828e-cbbeb8987038,Adnan,https://play-lh.googleusercontent.com/a-/ALV-UjWbjAk75QXJnWhLHpt4aGU97aO10xljkbkfjGqJIsXxnIkWbaOc1Q,much needed update finally happened. valve ditched html5 wrapper (mostly) feels like native app - faster smoother. still questionable design elements clearly part history. hope continue regularly update app bring closer functionally desktop version much possible. still feels pretty bad. far cry actual steam app windows.,3,4,3.10.6,2025-12-29 09:17:39,,,3.10.6
c99a9952-0944-4f08-8d47-dcdd3b2615f9,Devaang Sharma,https://play-lh.googleusercontent.com/a/ACg8ocKmEMrkna3chBjON8Gxie5x7r0ZE3onl8tXqS5PxBLciLyEyA=mo,"one issue app. whenever inside game page let's say want go back, click back button, app closes. ideally go back home page clicked game. fix issue.",3,2,3.10.6,2025-12-21 13:15:10,,,3.10.6
9fb7081d-c6bf-4099-96e7-0d43f91103ce,See Zhen Han,https://play-lh.googleusercontent.com/a-/ALV-UjVga8Ws225WQW8y81eE8MF6eTHCZoBn98V8awkc9sgFmsGJfOg,"check game price discount event.this app brings lot easier without using laptop.but recently,the app loading menu stuck like 1 weeks.please value,fix problem.without app,make waste time laptop.",3,2,3.10.6,2025-12-21 18:45:26,,,3.10.6
99fba434-fea8-4ae7-890e-4ca506300884,Dan Jhayniel Javier,https://play-lh.googleusercontent.com/a/ACg8ocIvv4E5Px71Qf_bfUyxrU7seZR-9Y53VVogbOC4EplszspaCg=mo,steam support responsive quick! download pc games desktop running well. rather rate 3 stars best!,3,0,3.10.7,2026-02-28 13:57:36,,,3.10.7
e1da56b8-ccec-4016-b0b2-e90511f8fa38,W Paap (WizX20),https://play-lh.googleusercontent.com/a-/ALV-UjWXb3M338c_40MUulfO8JLU4EEepbhwtmdKrKHi_OdjKnzVutY,"interface bit hard navigate sometimes. video player/slider broken game details, goes next item playing video, videos laggy stutter.",3,0,3.10.6,2026-01-08 19:17:48,,,3.10.6
dd4c44ef-8b7a-47fe-8405-e392169f8514,A G,https://play-lh.googleusercontent.com/a/ACg8ocJpM5dQe6iXWZ9B53NPejVzDsuLd5twCiBE5hEn2NZdrWsDLQ=mo,go back home screen clicking one sales. android back button closes app. restarting app fixed app seems still buggy.,3,0,3.10.7,2026-02-08 23:56:48,,,3.10.7
bf916f30-a83f-45be-becd-b3522b1bbe8e,Cygn,https://play-lh.googleusercontent.com/a-/ALV-UjXRTDuwtMF-wt5zaIOSYTnk2cC-7J3S03JHNDhm9NRbuJ1Pb78,"rlly get games available ios android. like even reason behind this? love steam, pricing regional. purchase games 'cuz play em mobile annoying. pleasee make games available android!!",3,2,3.10.6,2025-12-26 23:24:19,,,3.10.6
9486c0b3-d175-435f-8e2a-65ba76534168,Don Nurk,https://play-lh.googleusercontent.com/a-/ALV-UjUXDRDSixErYwF4TR4S-b-bVTlLp-wXr22T1gwsBWfVYpA2GRJGuA,"ok, however trying look friend's library know private, tapped ""filter games own"" button, literally nothing, know works desktop unlike 90% steam users, im desktop 24/7/365 rotting chair.",3,1,3.10.6,2025-12-21 10:46:20,,,3.10.6
ecd176ca-280f-4b85-91dc-c790ba1badbf,Megan,https://play-lh.googleusercontent.com/a-/ALV-UjW2tOqM0A6e334cc19qdrqK2zF49gLbsk8q4Et4sr4S0HFofGFtdA,"decent app, please stop auto scrolling game screenshots! trying admire game developer's work hard auto scrolls every fews seconds. please, least add toggle settings turn auto scrolling off.",3,0,3.10.6,2025-12-25 00:27:46,,,3.10.6
a7f99614-b646-4838-ae34-87eace55097c,basiliotornado,https://play-lh.googleusercontent.com/a-/ALV-UjWWKvzYVDwIPDFWy6xL78xv16oVuC5wsroop6LQsBij1jNCnKg8,"personally understand need link phone number able sign qr code. want phone number account guess problem, wasted bit time.",3,0,3.10.6,2025-12-30 02:18:19,,,3.10.6
a0258ea8-eb2b-4deb-8c6f-6a283708ad3f,Noctiluus,https://play-lh.googleusercontent.com/a-/ALV-UjXggZkwpicah0sUAVgA-eH1YByaLiPTfzREfg5mFgB0A0oTzx8,good adding games wishlist. appear show adult content recent events & announcements. regardless preference configuration.,3,0,3.10.6,2026-01-18 08:05:49,,,3.10.6
56230421-45b5-4f1c-b80a-7ea7c26b0780,Pranjal Soni,https://play-lh.googleusercontent.com/a-/ALV-UjUaBW63cKcbHKlWMvUoteFLcFZvEMCtzhByYM4EX1S2AX-bSEQC,app good needed connectivity server bad content takes time show sometimes shows nothing all.,3,1,3.10.7,2026-01-30 14:09:33,,,3.10.7
31667dcb-80d6-4d18-8e84-9985efd663b7,Jonathan,https://play-lh.googleusercontent.com/a-/ALV-UjUsqsXX8i8XQXK-qzsMitjEXLiHakSwUmXV6Sr2gvmIBYWQVmhj,"pages try go dont load. refreshed, forced stopped app. still issues able see certain things",3,2,3.10.6,2025-12-25 08:28:44,,,3.10.6
90f0c9b7-3812-41ef-ab48-38558945926e,Josh Smith,https://play-lh.googleusercontent.com/a/ACg8ocIYz240uxMFTHmh6iShp7EdDO1uVDPe34D2lEvcUIUMYs4zug=mo,"trouble getting library saying oops something went wrong, delta force saved library library loading",3,0,3.10.6,2026-01-05 19:22:27,,,3.10.6
f94606de-a55c-421b-bb0b-7d817f627b34,Ezren Wiatrowski,https://play-lh.googleusercontent.com/a-/ALV-UjUzM10qLneTLCdALfzokE7gn2QoDCRj0EvE_AIMScuxMX4zURjD,great steam guard. terrible game browsing. keeps closing browsing.,3,1,3.10.7,2026-02-03 04:29:53,,,3.10.7
ea729a27-7ae8-4ff6-a437-691032b6aa0d,bozaisdead,https://play-lh.googleusercontent.com/a-/ALV-UjVuKFoblR1IS3w5PVmsa-a-IG2aOsu8dpbttqzo20x9zNBSgTk,everythings good sometimes window glitches steam profile isnt displayed (partially blacked out) even perfectly fine desktop version app,3,0,3.10.6,2026-01-08 23:07:38,,,3.10.6
3b9acbb5-5f46-4b13-84bb-12afe9094f62,Jo jo,https://play-lh.googleusercontent.com/a-/ALV-UjVrrn1ECgy6X1GXlpM7AuQnLqa6lH-o4bUBx_GEVx1-YCxV2TmeaQ,"thing bothers features causes app crash, example trying view friend list/friends profiles",3,0,3.10.6,2026-01-07 10:42:34,,,3.10.6
64446b8f-6565-4cde-9510-65bce3d8b81a,Al Souza,https://play-lh.googleusercontent.com/a-/ALV-UjWQZfiIgwB9mQ-onNGyavsXITU4fbHChhVjhrHYHulx55EVG710,"good, lil silly specifically mobile still cant games bought steam specific mobile games without steam link. seems counter productive even mobile version?",3,0,3.10.7,2026-02-11 04:29:30,,,3.10.7
2bc16ba9-ad7e-448c-bf74-f8791a414ab5,Oran Stapel,https://play-lh.googleusercontent.com/a-/ALV-UjUMhHVBjFw5ImZlogUO44DNNcVaqCCm8MGYFfbf3jN7abJWs4fS,recover account verify email send. luckily password changed :( log in.,3,0,3.10.7,2026-02-25 21:13:08,,,3.10.7
b0b8a2f9-2886-438d-ab0a-fed3c992658b,John Andrey Milano,https://play-lh.googleusercontent.com/a/ACg8ocL9sDbqIMQvg--sZCCWusqKOcNaWOHvKBKQuElJTAoAtXmU6Q=mo,problems steam app trying pay game. keeps redirecting playstore install gcash even already it. tried using different methods outcome still same.,3,0,3.10.7,2026-01-27 17:37:33,,,3.10.7
8c1d8261-9c12-41a8-ad4a-1d7ec01f6c24,Ayden Henkel,https://play-lh.googleusercontent.com/a-/ALV-UjV0oKt9VDni9ZmYyc3fnSnxycX2hlsA_dSisIkLsAPg9q5yA4VUYA,love problem start downloading something pause matter still download even pause,3,0,3.10.6,2026-01-19 09:46:04,,,3.10.6
7199ca15-323b-4230-b610-a69da30339b0,Nerossu (Nerossu),https://play-lh.googleusercontent.com/a-/ALV-UjUCupkf0MXMWIJTP2TAU2YG1cqO5vq4tURenZahEU0eVAScz4YL,"tells sign even though already signed gives server error try ""sign in""",3,2,3.10.7,2026-02-05 05:54:51,,,3.10.7
4ddf3569-34f2-419a-bd27-46a25dc6537e,Stephen Emo,https://play-lh.googleusercontent.com/a/ACg8ocJXSES6YCt2js6m8ZS4VsgIIXRsxXoLMQQ1XlZPgCTZYoksrw=mo,family management requests work mobile app. visible click,3,1,3.10.6,2025-12-28 02:10:15,,,3.10.6
d084ddad-d88b-4171-b499-10bcf5cd64e0,T.K. Oh,https://play-lh.googleusercontent.com/a-/ALV-UjXJIoumGSI1D0vtM3KbZL0Q8jMk1lL38ylGow1Tss-QDOua7FGv,"maybe matter development team, busy, app buggy mess compared desktop version. even go steam points shop scroll sideways selection without crashing home screen. fully support business, time, come take look app. thank you.",3,178,2.3.12,2020-11-02 01:59:50,,,2.3.12
1c84122a-2976-4511-8570-46dfd987f26f,Denny A. Mendoza L.,https://play-lh.googleusercontent.com/a-/ALV-UjU819-0b1wYT38YRM9zkx0nQRbvLmVEpZntXni8o5JLCEvFrVn6ig,allow games steam library sync geforce now.,3,0,3.10.7,2026-02-12 13:26:38,,,3.10.7
a48feba7-384b-4433-9b11-fb90d8454e57,Deborah Mason,https://play-lh.googleusercontent.com/a-/ALV-UjWYv9sYWSN0AbvQmtbkhoyZh54VpUuPfJbSA35r0_UgeHv9z4Xt,"downloaded waiting time selling trading cards community, still telling wait 15 days.",3,1,3.10.7,2026-01-30 14:32:32,,,3.10.7
4963b5ca-c450-44da-a4ea-aa7120c99185,I Love Sylveon,https://play-lh.googleusercontent.com/a-/ALV-UjWUDQ0mCB5MbiziyBtnuKMxE3b4-1xJ_tcLdVYWQabV4PqOqeI,"every day, there's sort glitch refuses load app.",3,0,3.10.6,2025-12-25 06:59:59,,,3.10.6
8383ef2f-d4c5-4192-aa1f-4aa67bab08c0,Matt Kay,https://play-lh.googleusercontent.com/a-/ALV-UjWGsHLHe2ivwsfuOJgJGJhJQQBHl3981TNJ6t-bS0DBe8CbOZrCLA,library needs seeing big games minimal filters,3,0,3.10.6,2026-01-21 17:06:56,,,3.10.6
aadebf9a-fa53-46a9-a7d7-0c91adf66468,Draekyn Mcbride,https://play-lh.googleusercontent.com/a/ACg8ocK5Ot18YVW_CAIy5X6YQwqM7PDw4BR8dS0P-KGhzjbB7ki-2w=mo,rated 3 stars went google play download said app unsupportable device love fixed,3,23,3.10.6,2025-12-23 05:51:38,,,3.10.6
b249625d-072d-454d-a83e-49d990013c40,august vctjuh,https://play-lh.googleusercontent.com/a-/ALV-UjX_QlIiT9NdEMhDlwJEbJZoc-K1xcJjkvZOaaHfkTQqQdGg4B4,mostly fine autoplaying videos streams mobile data good,3,0,3.10.6,2026-01-11 20:08:55,,,3.10.6
fc931fc5-942d-4f8d-9e20-739722c1a6ae,Karla Ibsen,https://play-lh.googleusercontent.com/a/ACg8ocJTSzpWSPVMTzMwA-imudcIIKDuQkoZfXQa7_CjQpiCZpSGyBc=mo,anything. account works windows pc. idea work android tablet.,3,2,3.10.7,2026-02-07 12:52:18,,,3.10.7
15cb162b-6768-4f12-abf5-bb764b8caf2c,Joseph Y,https://play-lh.googleusercontent.com/a-/ALV-UjVs4PQ0HQVYXBRXjlOV8tKIVWDCjUagMicoR8fo_mVxWk6Gv4Rh,steam guard worked since january 28th. even buy games anymore.,3,1,3.10.7,2026-02-05 22:04:47,,,3.10.7
af03927e-b6c4-442b-8a6f-6fd642fed028,Lenard Ace,https://play-lh.googleusercontent.com/a-/ALV-UjUPQdCoq9nXV7BZHC8m9zB06TmgG0s7COc1asiyhWdEbcmWN0qQ,"ok computer phone, access main page says: ""access denied""",3,0,3.10.6,2025-12-25 23:10:16,,,3.10.6
ee245897-0ceb-4651-afec-8e5b21f21370,Ethan Dunnell,https://play-lh.googleusercontent.com/a/ACg8ocIqSax83MMX6_ozqaWroxgmESDXDtFmffnIBnXfOCfO8n3jHrfF=mo,"good easily searching store, looking wishlist rearranging it. unfortunately late purchase anything. paypal continues ask email card fully accept sits banks pending times days. items put basket that's now. used work fine.",3,11,3.4,2023-02-19 06:07:10,,,3.4
483af538-3053-40cb-9f09-1ee98ea4682d,Lego Kulitz,https://play-lh.googleusercontent.com/a-/ALV-UjV04TV2wowWC2K5DvMS3IO51nyHx8P2M5-vmIxLqMQ-XvnoGtVO,"try purchase game add funds wallet via gcash, app proceed gcash app, instead goes playstore show gcash download. please fix this.thank",3,0,3.10.6,2026-01-17 16:15:38,,,3.10.6
28cb5768-bd14-4ab3-8b94-db29b36c072e,Володимир Снігур,https://play-lh.googleusercontent.com/a-/ALV-UjX1ML1NH3YjW9-kkZfHNPEzOchTE3MtkAdtUYi5oOJVBxjpudID,"ok, bad, work good previous app. also yeah, needs steam guard code enabled. app 2fa needs 2fa code many people app. way lock people accounts. anyhow, app modern, yes, also bit slower previous versions, least works decently streamlined. -3☆ potential account lock +1 app works kinda like ui. result: 3/5 bit worse was.",3,0,3.0,2022-10-28 05:53:18,,,3.0
3e96cf7e-4806-4d0f-9b96-9845332ad049,Brush Tharp,https://play-lh.googleusercontent.com/a-/ALV-UjVyzTipJQZKCrGl_oBE-8Oz8fjgFQrnE0CqGY_IIWd08e51npMpJw,"app amazing, buy games message steam people go wherever am. biggest problem gift game anyone using steam mobile app, time try, takes money, transaction fails steam's side. important say bank eventually released money intended game. fix that, give sandwich.",3,104,2.3.13,2022-09-11 00:38:54,,,2.3.13
3737de11-e434-445d-99db-8aaa69ff95bc,Daniel Liu,https://play-lh.googleusercontent.com/a/ACg8ocLFwOXvuIIA3d_AkOL_c56fdYklZZbHnlG4ozw7WwLRE2O6EQ=mo,"even app rated 5 stars functional, company indicted digital price gouging. addition, 7 day ""steam guard"" 3fa trade lock completely unnecessary majority users. steam website even allow stay signed day, keeps logging spams asking underage not. vr games steam games labeled properly. reason ui button full screen actually ""big pi",3,3,,2025-12-24 23:34:53,,,
2a755fb7-c12f-437a-b356-579c4704b431,A Google user,https://play-lh.googleusercontent.com/EGemoI2NTXmTsBVtJqk8jxF9rh8ApRWfsIMQSt2uE4OcpQqbFu7f7NbTK05lx80nuSijCz7sc3a277R67g,"made app probably to, wanted to. forces online every time open app, option browse news, etc without drawing attention. also tampers steam launcher status, update even sign out/uninstall app. quick google search learnt many issues years old, never cared address those. think care enough mobile authenticator either.",3,43,2.3.7,2019-01-13 19:42:11,,,2.3.7
d7733da2-6ee4-4d8e-b473-e908ffb60897,Kai-el van Zyl,https://play-lh.googleusercontent.com/a/ACg8ocKbAJRgooJiEh_XZxIgARSpgnnYThqjihiKusdu7KySp3ja=mo,"trying sign mobile app, tells must authorise steam mobile app trying sign into. go long, ridiculous process switch authoriser, type email, put password, etc etc. half hour later, still signed in. security process extremely long winded unesscery. puts using steam. want use complicity user friendly.",3,81,3.10.0,2025-06-28 17:48:37,,,3.10.0
a6fe22fe-9d38-4bbf-bcfc-24648c9f931b,Snale,https://play-lh.googleusercontent.com/a-/ALV-UjUaA5BRJCcFHgdCHmUWXjT14KrY8b_mDL-K69YrLT3QnHu6nrOd,"app works basic stuff expect, like steam guard, buying games, managing wishlist stuff like that, used much better redesign. new ui looks nicer features missing (steam chat longer integrated app,now requires separate app use), stuff like library section far annoying navigate, able sort stuff like playtime default, switches alphabetical every time. shame.",3,31,3.6.0,2023-07-30 09:55:57,,,3.6.0
8321aa09-74b0-4e09-ae1f-55a9cb8bdf0f,A Google user,https://play-lh.googleusercontent.com/EGemoI2NTXmTsBVtJqk8jxF9rh8ApRWfsIMQSt2uE4OcpQqbFu7f7NbTK05lx80nuSijCz7sc3a277R67g,"like recommend this, logged account morning trying day log back in, trying sorts recommended fixes, avail. honestly really offended, app decent works, stops working infuriating thing, never seems anything done user's end.",3,10,2.3.1,2018-09-26 16:09:01,,,2.3.1
414c3f9e-aa79-42d4-a788-8dee574f6c21,Hexx Bombastus,https://play-lh.googleusercontent.com/a-/ALV-UjVjpKDLRPCfUAGV9sgyZJiOS_XYlUj8hH_-na_jlZxRpgsnoC_M,"annoying even though every setting find get app send push notifications new chat message, remains completely silent. ping, notification pull down, nothing. please fix. like chatting friends, effectively know talking even online.",3,5,3.6.3,2023-07-08 08:27:02,,,3.6.3
3655e381-190e-4ac0-ae8b-225cb37d1c8d,Veselin B (Flammable),https://play-lh.googleusercontent.com/a-/ALV-UjV6xlEAYeMxqkqVQJ0PCsri0xhh5VReVmzfMqbG9WvvvMx8lk4Q,"bad update sure get used understand chat separated. bult in, instead another app download first multi accounts option. switch go 2 steam profiles like chat app like main one. also widget missing guard codes in-app always prompted scan qr code.",3,1,3.0,2022-10-15 16:24:19,,,3.0
9acc928a-747e-4c9e-8cd2-92ec239c6855,Cecco,https://play-lh.googleusercontent.com/a-/ALV-UjVAHWU9mrPNRqj2BQ2gdP0dNGY15XzaSxlGNYNOg0i-7x-TOBg,"steam phone works worse, years ago make join account phone pc worked fine. sometimes pretty convenient sales. xbox ps sales lower costs (i spent 10€ game ps store instead 30€ steam). pc pretty good, library put favorites games liked most. saves games account great (but phone works bad)",3,1,,2023-04-10 02:50:51,,,
d4a21b3d-f451-43cb-8d72-c8e428575afb,Najia Horack,https://play-lh.googleusercontent.com/a-/ALV-UjVSuvqhW8Gia3TbrA7PawGDJ7nMdMJ2o1Rb7yr_vF26oqxEkv1xig,"expect. pretty much features desktop. pc still alot better reasons mentioned reviews. giving 3 star support issue useless. said thing twice told wait september 4th, offers games tried buy longer available. seriously seemed like even look screenshot properly. isnt useful all. honestly expected more.",3,5,3.6.5,2023-08-06 15:25:27,,,3.6.5
f1148b29-e312-4a33-8b2e-dedadc2b5c61,Feathering Walthamstone,https://play-lh.googleusercontent.com/a-/ALV-UjU_kLkxiFD0pCf9u32DsZ43LiiNM2yqTUK7tdMJa_08MH1EEq0-,"years on, still refuses open window login paypal. reauthorize pp thru webpage every couple months. recently, freezes often playing video. matter what, must re-confirm age every time open app, order see games rated mature. minor bugs edge cases get fixed regular, core features left rot. games delisted cart unidentifiable. happened least 3 times last year. cart sunday, delisted monday.",3,63,3.9.2,2024-10-27 22:34:03,,,3.9.2
deda27a4-1a11-44a3-817d-14eea9066e55,A Google user,https://play-lh.googleusercontent.com/EGemoI2NTXmTsBVtJqk8jxF9rh8ApRWfsIMQSt2uE4OcpQqbFu7f7NbTK05lx80nuSijCz7sc3a277R67g,"steam mobile app great tool steam users. great sync, easy navigation, must trading all. gripes sometimes friend's messages come through, forcing close re-open app appear, app really use visual overhaul, long overdue given official steam client makeover.",3,8,2.3.13,2021-10-24 18:53:50,,,2.3.13
a06b82db-fead-4d36-8b44-671c2f11b19e,Dookie Smile,https://play-lh.googleusercontent.com/a/ACg8ocKsFY3vul37sEt6OWMevqOnTDvV4l-dbccHsuQkkKRcRJ-J6Q=mo,"recent ""upgrade"", steam guard widget phone's home page. simply swipe profiles see authentication code single click. now, longer widget, instead open steam app, go steam guard page, choose profile dropdown, click ""show steam guard code"" button, click second ""show steam guard code"" button! possible bring back steam guard widget? much convenient.",3,6,3.0,2022-10-21 19:25:54,,,3.0
